Channel Name,date,videoId,titles,Comment
호갱구조대,20220810,pOpYOLcOQxs,님들이 뭔데요....?,"단속 해야할 공무원들이 제대로 일 안하니까 
문제 아닙니까?   이재명 지지자는 아니었지만 
이런거 하나는 잘 했는데  그 후임들은 흉내라도 내보세요.  뭐 인맥 연결 되있고 돈이라도 먹어서 봐주는건가요?"
호갱구조대,20220810,pOpYOLcOQxs,님들이 뭔데요....?,유튜버야 남양주시장의 정책을 찢재명이 한거마냥 포장하지마라
호갱구조대,20220810,pOpYOLcOQxs,님들이 뭔데요....?,"조금만 찾아봐도 계곡 정비 사업은 조광한 남양주시장의 주도로 이뤄진 업적인데 이재명이 강탈한 것이라는 데에 관련한
법적 논쟁이 있다는 것을 호갱구조대가 모를리가 없는데 몇번이나 이재명의 치적으로 강조한 부분을 보니 채널 운영자의 정치스탠스가 짐작이 되는군요
본인 지지여부야 상관없으나 명백히 밝혀지지 않은 사실을 호도하는것은 메가채널에 어울리는 운영방식은 아니라 생각합니다"
호갱구조대,20220810,pOpYOLcOQxs,님들이 뭔데요....?,외가 놀러가면 거기 계곡이 있어서 항상 친척들이랑 물놀이 하곤 했는데 어느순간 평상이 깔려있더라구요... 그것때문에 오히려 물놀이할 공간도 줄어들고 왠지 모르게 눈치 보여서 놀러 갈수가 없게 됬어요
호갱구조대,20220810,pOpYOLcOQxs,님들이 뭔데요....?,"남양주시장이 대단한 일을 하셨지. 

그것을 마치 자기가 한일인것처럼 포장까지한 머저리 이재명 ㅋ"
호갱구조대,20220810,pOpYOLcOQxs,님들이 뭔데요....?,"모르겠네요 쓰레기 함부로 버리는 쓰레기들이 많아서 저런게있어서 잘놀다 갈수도있는거같기도하고 헌데 자리값이라며 백숙값이 너무 오른것같네요
저도 계곡 하천 산 바다 좋아하는 사람인데 낚시만 딱하는스타일이죠
캠핑하는 사람들 쓰레기 버리고가는거 그게 더 꼴배기 싫네요
어제도 양주 공릉천에서 피래미잡다왔는데 그쪽에 노지캠핑하는 사람들 제법있더라구요
전 이쪽에 자주와서 담배꽁초하나까지 치우는 사람인데 쓰레기 버리고가는 쓰레기캠핑족들 좀 없어졌음 좋겠네요"
호갱구조대,20220810,pOpYOLcOQxs,님들이 뭔데요....?,걍 저런 불법장사 하는 애들은 다 금치산자로 지정해버리고 재산은 국가가 다 빼앗아가면 된다.
호갱구조대,20220810,pOpYOLcOQxs,님들이 뭔데요....?,2:15 모르고 있는게 아니라 알고 있고 권리금 못받고 쫓겨나게 생겼으니 저 지랄하는거 ㅋㅋㅋ 그나저나 싫어요가 1500명이나 있네 ㅋㅋㅋ 개새끼들 ㅋㅋㅋㅋ
호갱구조대,20220810,pOpYOLcOQxs,님들이 뭔데요....?,"저거 시골마을은 시청이랑 돈받아쳐먹고
운영함 깡패색히들이"
호갱구조대,20220810,pOpYOLcOQxs,님들이 뭔데요....?,전라도 고흥에가면 널렸지 90%가 불법점거 담치고 모텔까지 가면 수두룩삼 심지어 부두 밑에도 외부인 출입금지라고 써놓기 까지함 ㅋㅋㅋㅋㅋ 지역형 범죄
호갱구조대,20220810,pOpYOLcOQxs,님들이 뭔데요....?,"이런 사업장이 있어서 화장실도 있고 샤워실 주차장이 있습니다ㅠㅠ
상인이 무조건 나쁜건 아니더라고요
시청에서 운영하면 화장실 샤워실 관리안해요
주차시설도 없어요ㅠㅠ 한다고해도 주차대수 너무작고요"
호갱구조대,20220810,pOpYOLcOQxs,님들이 뭔데요....?,아니 그냥 ㅅ1발 걸리면 벌금 10억씩 때리라고ㅋㅋㅋㅋ ㄹㅇㅋㅋㅋㅋㅋㅋㅋㅋㅋㅋㅋㅋ 그러면 싹다 망한다고 ㅋㅋㅋㅋㅋ
호갱구조대,20220810,pOpYOLcOQxs,님들이 뭔데요....?,이재명이 대통령됫어야...
호갱구조대,20220810,pOpYOLcOQxs,님들이 뭔데요....?,조폭이랑 뭐가 다르냐.계곡이 너네꺼냐
호갱구조대,20220810,pOpYOLcOQxs,님들이 뭔데요....?,이걸 논리적으로 다 대답하셨지... 아하하하하하하아하
호갱구조대,20220810,pOpYOLcOQxs,님들이 뭔데요....?,"이재명은 합니다👍💙💙
이재명 이라 가능 했습니다 👏👏👏👏"
호갱구조대,20220810,pOpYOLcOQxs,님들이 뭔데요....?,요즘 다시 계곡에서 불법 영업이 성행 한다던데 단속 공무원들은 어디서 뭐 하는지;;;
호갱구조대,20220810,pOpYOLcOQxs,님들이 뭔데요....?,영상 너무 좋네요~
호갱구조대,20220810,pOpYOLcOQxs,님들이 뭔데요....?,이재명이 한게아닌데요
호갱구조대,20220810,pOpYOLcOQxs,님들이 뭔데요....?,상인들 미쳤네 지들이 무슨 자격으로 계곡을 점령하는데ㅡㅡ
호갱구조대,20220810,pOpYOLcOQxs,님들이 뭔데요....?,이재병이 아니라 남양주시장이 시작한것임 정보 똑바로 올려주삼
호갱구조대,20220810,pOpYOLcOQxs,님들이 뭔데요....?,"이님들은 산주인이야
리십마넌 닭은 안사면 못들어가"
호갱구조대,20220810,pOpYOLcOQxs,님들이 뭔데요....?,진짜 이거는 재명이형이 지렷네  다른지역들 뭐하냐 방관하고 불법사기꾼들 싸그리 없애야지 지땅도아닌데 자리값을 받아처먹는 ㅋㅋㅋ 어처구니가없네
호갱구조대,20220810,pOpYOLcOQxs,님들이 뭔데요....?,조용히 핸드폰을 들어 신고하면 됩니다~
호갱구조대,20220810,pOpYOLcOQxs,님들이 뭔데요....?,이재명이 확실히 일을 잘했네…경기도만 유일하게 관리가 된 거라니..대단하다
호갱구조대,20220810,pOpYOLcOQxs,님들이 뭔데요....?,"항상 영상 잘 보고 있습니다. 문득 의문이 생겨 댓글 남겨요. 너무 많은 댓글이 있어 읽으실 지는 잘 모르겠지만.. 실제 사유지, 즉 사업자가 해당 하천의 일부분을 실제로 구입해서 운영하는 경우나 혹은 정말 예전부터 하천의 일부 땅을 가지고 있다가 사업을 하는 경우도 없을까요?? 영상을 다 보고 궁금함이 생겨 댓글 남겨봅니다!"
호갱구조대,20220810,pOpYOLcOQxs,님들이 뭔데요....?,저기서 사먹는 빙시들이 있으니까 유지하는거
호갱구조대,20220810,pOpYOLcOQxs,님들이 뭔데요....?,"이재명은 합니다!
저런 놈들 다 찢어버려야 함"
호갱구조대,20220810,pOpYOLcOQxs,님들이 뭔데요....?,이런사람 등쳐먹고 사는놈들이 운영하는데는 안가면 되는데 왜이렇게 가서 돈을써주는거야
호갱구조대,20220810,pOpYOLcOQxs,님들이 뭔데요....?,경찰이 있으면 뭐 하고 정부가 있으면 뭐 할 거여 법이 사각지대
호갱구조대,20220810,pOpYOLcOQxs,님들이 뭔데요....?,제목 마음에 들어요 ㅋㅋㅋㅋㅋ
호갱구조대,20220810,pOpYOLcOQxs,님들이 뭔데요....?,신고하는법도 알려주세요
호갱구조대,20220810,pOpYOLcOQxs,님들이 뭔데요....?,찢재명... 솔직히 저건 인정 해줘야함 ㅋㅋ
호갱구조대,20220810,pOpYOLcOQxs,님들이 뭔데요....?,찢재명 당신은 도대체….
호갱구조대,20220810,pOpYOLcOQxs,님들이 뭔데요....?,계곡도 중요하지만 해운대 파라솔도 똑같음 ㅎ
호갱구조대,20220810,pOpYOLcOQxs,님들이 뭔데요....?,일하는거 눈에 보이는 정치인은 이재명밖에 없음
호갱구조대,20220810,pOpYOLcOQxs,님들이 뭔데요....?,야...완전히 날도둑놈들이네....
호갱구조대,20220810,pOpYOLcOQxs,님들이 뭔데요....?,"이번 여름휴가 경북 왜관 인근 계곡통제하는 사업장...들를수밖에없었다...
테이블값 닭도리탕 6만원ㅋㅋ..기본찬따위 말라비틀어져있고.. 그냥 자리값...물놀이 하느라 두어시간 놀다보니 비키라는 눈치..ㅎㅎㅎ"
호갱구조대,20220810,pOpYOLcOQxs,님들이 뭔데요....?,구독안할수가없어요👍🏻
호갱구조대,20220810,pOpYOLcOQxs,님들이 뭔데요....?,근데 이 분 목소리요 성우에요 ? 이 목소리 진짜 마니들림 뭐지..?
호갱구조대,20220810,pOpYOLcOQxs,님들이 뭔데요....?,나라는 좁고 쓰레기새끼들은 많다
호갱구조대,20220810,pOpYOLcOQxs,님들이 뭔데요....?,역시 이재명..
호갱구조대,20220810,pOpYOLcOQxs,님들이 뭔데요....?,불법 걍 사라져라..
호갱구조대,20220810,pOpYOLcOQxs,님들이 뭔데요....?,ㅋㅋㅋㅋㅋㅋ 와 예전에 50-100 과태료 ㅋㅋㅋㅋ 백숙한마리에 십마넌인데 ㅋㅋㅋㅋㅋ 진짜 솜방망이 처벌 미치겠다 하
호갱구조대,20220810,pOpYOLcOQxs,님들이 뭔데요....?,맞는 얘긴데 공감이 안간다. 1번째 유투버로 하지말고 국회로가. 2번째 자기지신도 불편한걸 알리는건 좋은데 남들한테도 과연 불편 하겠어.3번째 상인들 쫒겨나도 다른데서 장사는데 방송 하겠어.4번째  이재명 지사가 잘 했지만 결국 다 잠들었자너.또 장사하고 난린데 당신이 말리던가 선동을 할려면 팩트는 집은것 갔지만   밀고 나가든가 선동만 하고 빠지는건가. ? 당신한테 물어 보고 십다. 진정한 유투버라면 알고 있는 내용 떠벌리지 말고 지금 가서 얘기좀 들어봐.서민들 하고.난  짜증나는거 있는 얘기인데 도 가만 있는다. 왜? 똥밟았으니까.
호갱구조대,20220810,pOpYOLcOQxs,님들이 뭔데요....?,안하는거죠.
호갱구조대,20220810,pOpYOLcOQxs,님들이 뭔데요....?,이재명만세
호갱구조대,20220810,pOpYOLcOQxs,님들이 뭔데요....?,이재명이 한게 아닌데
호갱구조대,20220810,pOpYOLcOQxs,님들이 뭔데요....?,갓재명
호갱구조대,20220810,pOpYOLcOQxs,님들이 뭔데요....?,"근데 권리금을 누구한테 주는거야?
계곡자체에 땅주인이 없을텐데"
호갱구조대,20220810,pOpYOLcOQxs,님들이 뭔데요....?,누가 술먹고 깽판쳐라 저딴놈들은 인간이길 포기햇다 ㅋㅋㅋㅋㅋㅋㅋㅋㅋ
호갱구조대,20220810,pOpYOLcOQxs,님들이 뭔데요....?,일단 하천 근처에서 장사하는 애들 모두가 국유지 무단점용 하면서 장사하고 있는 애들임 ㅋㅋㅋ
호갱구조대,20220810,pOpYOLcOQxs,님들이 뭔데요....?,이재명 경기도지사 짱이었는데
호갱구조대,20220810,pOpYOLcOQxs,님들이 뭔데요....?,언제적 이야기냐? 팩트를 좀 밝히고 해라 이 짜식아
호갱구조대,20220810,pOpYOLcOQxs,님들이 뭔데요....?,그냥 버러지들  존나  버러지들  상인  아니고 범죄자들
호갱구조대,20220810,pOpYOLcOQxs,님들이 뭔데요....?,이재명이 저거 계곡 관련해서는 잘 했지
호갱구조대,20220810,pOpYOLcOQxs,님들이 뭔데요....?,계곡갔을때 평상아래 물좋아보이는 계곡이 있던데..사유지라서 평상 빌리고 들어가라고 하던게...다 불법이었다니...몰랐네요..
호갱구조대,20220810,pOpYOLcOQxs,님들이 뭔데요....?,재매이햄 씨다씨~
호갱구조대,20220810,pOpYOLcOQxs,님들이 뭔데요....?,우리나라가 원래 불법을 해야 돈이 빨리 벌긴하지
호갱구조대,20220810,pOpYOLcOQxs,님들이 뭔데요....?,호갱구조대 사랑해
호갱구조대,20220810,pOpYOLcOQxs,님들이 뭔데요....?,공무원이 무능하단 말이 괜히 나오는 게 아닌가 봅니다...
호갱구조대,20220810,pOpYOLcOQxs,님들이 뭔데요....?,재명이가 싹 밀어버렸는데 또 꾸역꾸역 생겨나네.
호갱구조대,20220810,pOpYOLcOQxs,님들이 뭔데요....?,아주 처돌았내 계곡이 지들꺼야? 저거 불법이라 지자체에 신고 하면 바로 벌금이나 차후에는 징역도 가능함
호갱구조대,20220810,pOpYOLcOQxs,님들이 뭔데요....?,사실상 이재명의 유일한 업적
호갱구조대,20220810,pOpYOLcOQxs,님들이 뭔데요....?,쳐먹는긋들이 있으니 배째라지..
호갱구조대,20220810,pOpYOLcOQxs,님들이 뭔데요....?,전과4범이 유일하게잘한일ㅋㅋ
호갱구조대,20220810,pOpYOLcOQxs,님들이 뭔데요....?,100만 구독자 축하드려요🥳
호갱구조대,20220810,pOpYOLcOQxs,님들이 뭔데요....?,이재명이 이걸 해결했는데
호갱구조대,20220810,pOpYOLcOQxs,님들이 뭔데요....?,계곡주변은 전부 국유지로알고있는데? 간간히 국가에서 농촌의 수입증진을위해서 마을에 허가를해주고 공동운영을 행하는것은 있으나 개인이 이윤을 취득하기위한 행위는 무조건 불법이다
호갱구조대,20220810,pOpYOLcOQxs,님들이 뭔데요....?,"가만히 보면 한철에 늘상 이용객은 있어서 근절이 안될거 같으면, 아예 지자체 공공근로사업 같은걸로 전환시켜서 거기서 나는 수익금을 하천 관리나 공공사업에 자금원으로 하는 방법은 어떨까도 하지만....되려나..."
호갱구조대,20220810,pOpYOLcOQxs,님들이 뭔데요....?,이재명이 유일하게 잘했던것ㅋㅋ
호갱구조대,20220810,pOpYOLcOQxs,님들이 뭔데요....?,"절대로 무시하고 들어가지 마세요
지역 조직과 다 연결되어 있습니다.
조직뿐일까요?"
호갱구조대,20220810,pOpYOLcOQxs,님들이 뭔데요....?,신고자에게 포상금 지급한다고 하면 되지않을까요
호갱구조대,20220810,pOpYOLcOQxs,님들이 뭔데요....?,이재명  의원  대통령되서  전국  다해야됨
호갱구조대,20220810,pOpYOLcOQxs,님들이 뭔데요....?,그냥 가서 무시하고 놀면 됨 ㅋㅋㅋㅋ 돈주고 노는 사람들이 불쌍한거지
호갱구조대,20220810,pOpYOLcOQxs,님들이 뭔데요....?,이런사업장 많이늘리자
호갱구조대,20220810,pOpYOLcOQxs,님들이 뭔데요....?,재매이햄 이건 잘했노 ㅋㅋ
호갱구조대,20220810,pOpYOLcOQxs,님들이 뭔데요....?,대구 사지만 경상도는 너무 심함... 너무짜증남
호갱구조대,20220810,pOpYOLcOQxs,님들이 뭔데요....?,죄다 쓰레기 새끼들이에요 ^^
호갱구조대,20220810,pOpYOLcOQxs,님들이 뭔데요....?,"벌금을 100배로 늘리면 장사,캠핑족 싹다 사라짐"
호갱구조대,20220810,pOpYOLcOQxs,님들이 뭔데요....?,계곡가면장사꾼들사기꾼들많음
호갱구조대,20220810,pOpYOLcOQxs,님들이 뭔데요....?,아는 사람은 다아는 얘기아닌가 아직도 호구들잇나
호갱구조대,20220810,pOpYOLcOQxs,님들이 뭔데요....?,"아무리 불법영업이여도 십수년간 아무 제재도없이 장사해왔는데.. 그걸 없애는건 결코..
쉽지 않아요.. 근데  그걸..
이재명 의원님이 해내셨죠..
다른 의원들도 못 하는건 아닙니다. 다만..
엄청 귀찮고, 번거롭고, 신경써야될 문제가 엄청 나겠죠.. 그 귀찮은걸 찾아서 하는 사람이 있습니다."
호갱구조대,20220810,pOpYOLcOQxs,님들이 뭔데요....?,"바로신고함됨
경찰하고   관할 구청에신고함 됨
그럼 그날은 들어갈수있음  담날은모르겠지만 ㅋ"
호갱구조대,20220810,pOpYOLcOQxs,님들이 뭔데요....?,"이재명 덕에 그나마 잡히나 했는데
다시 성행중"
호갱구조대,20220810,pOpYOLcOQxs,님들이 뭔데요....?,이재명 돌아와요 ㅜㅜ
호갱구조대,20220810,pOpYOLcOQxs,님들이 뭔데요....?,이재명 도지사 끝나니깐 다시 다른 벌레들이 기어와서 불법점거 한다고 하던데 ㅉㅉㅉ
호갱구조대,20220810,pOpYOLcOQxs,님들이 뭔데요....?,싹 다 밀어야지
호갱구조대,20220810,pOpYOLcOQxs,님들이 뭔데요....?,요즘 철거했다는 자리 가면 그자리에 다시 불법으로 설치해서 장사하는걸 뉴스에서 본거 같은데
호갱구조대,20220810,pOpYOLcOQxs,님들이 뭔데요....?,올바르게좀벌어라이벌레들아
호갱구조대,20220810,pOpYOLcOQxs,님들이 뭔데요....?,"이런 문제를 국가나 지자체가 암묵적으로 눈 가리고 아웅식으로 해결 안하니 선량한 국민들이 피해보는거지
에라이 무능한 정부 퉤!"
호갱구조대,20220810,pOpYOLcOQxs,님들이 뭔데요....?,"이래도 가서 돈주고 처먹는 등신들이 아주아주 많다는게 신기할 따름이다 ㅋㅋㅋㅋㅋㅋㅋㅋㅋㅋㅋㅋㅋ
불법인걸 알면서 가서 처먹고 바가지다 억울하다 인터뷰 하는거 보고 진심 소름돋음 얼마나 멍청해야 ㅉㅉ"
호갱구조대,20220810,pOpYOLcOQxs,님들이 뭔데요....?,백숙 질긴거 한마리에 12만원 최저가 갱신
호갱구조대,20220810,pOpYOLcOQxs,님들이 뭔데요....?,불법 사업장 방치하는 공무원이나 지자체들
호갱구조대,20220810,pOpYOLcOQxs,님들이 뭔데요....?,아니 우리맘대로 계곡가겠다는데 굳이 백숙을 시켜야돼?? 와;; 이건 말이 안되지 ㅡㅡ 주변에 백숙 안먹겠다는 사람들도 있는데도?? 치킨이나 피자 족발 시키거나  사먹겠다는 사람들도 있는데도??
호갱구조대,20220810,pOpYOLcOQxs,님들이 뭔데요....?,바다도 똑같나요?
호갱구조대,20220810,pOpYOLcOQxs,님들이 뭔데요....?,이재명이랑 대화하는거 들어보면 가관임 ㅋㅋ
호갱구조대,20220810,pOpYOLcOQxs,님들이 뭔데요....?,한철로 투자금밖에 벌지 못했다? ㅅ ㅂ 얼마나 피를 빨아 쳐먹은거냐? 동정심 일도 없다
호갱구조대,20220810,pOpYOLcOQxs,님들이 뭔데요....?,"벌금을 더 올려라
3개월만에 투자금 뽑았다는게 더신기하다
얼마나 해쳐먹었으면 뽑을 뽑냐?
3개월장사해서 3년은 먹고 사는구나"
호갱구조대,20220810,pOpYOLcOQxs,님들이 뭔데요....?,"와 진짜 호갱구조대 채널 너무 좋아요
어려운 얘기도 알아듣기 쉽게 얘기해줘서 어떤 사람이든
잘못된 시민 의식을 깨워줘서 좋은 영향력을 주는 채널..."
호갱구조대,20220810,pOpYOLcOQxs,님들이 뭔데요....?,"윤 대신에 이재명이 됐으면 그나마 나라가 돌아갈텐데,,
지금은 무정부상태 ㅇㅈ"
호갱구조대,20220810,pOpYOLcOQxs,님들이 뭔데요....?,"계곡불법장사를 막는다해도
결국 방문객에 의해서 
오염훼손되는 건 부정할수없는 현실
허나 그것이
불법노점의 정당성을 확보해주는 것은 아니므로
불법은 근절되야하고
차후 시만에 의해 자연이 훼손되는 것은
그때 필요한 처벌을 하면 될것이다.
어차피 인간은 모두 죽을 것이기에
살인이 정당화 될수는 없기에"
호갱구조대,20220810,pOpYOLcOQxs,님들이 뭔데요....?,개 쓰레기 같은 신고대상 입니다
호갱구조대,20220810,pOpYOLcOQxs,님들이 뭔데요....?,이재명이 시작한거 아님. 남양주에서 시작했는데 이재명이 사람들 호응 좋은거보고 배껴놓고 자기가 시작한것처럼 언플한거야. 물론 이재명이 한 수많은 나쁜짓중에 유일하게 잘한정책
호갱구조대,20220810,pOpYOLcOQxs,님들이 뭔데요....?,이재명이 저길 다 쓸어버려야하는데
호갱구조대,20220810,pOpYOLcOQxs,님들이 뭔데요....?,"계곡 노점상 철거 좋지 
그에 앞서 불법노점상들 다 죽었으면 좋겠다 
찻길에 눌러앉아서 당당하게 장사하는꼴이 ;"
호갱구조대,20220810,pOpYOLcOQxs,님들이 뭔데요....?,그냥 저런 평상은 하천가는 피서객 모두 대가없이 사용할수있게 법으로 지정해두면 좋을텐데
호갱구조대,20220810,pOpYOLcOQxs,님들이 뭔데요....?,계곡불법장사치들 vs 살인마혈육변호사찢재명  기가막히는 대결이네 ㅋㅋㅋㅋ
호갱구조대,20220810,pOpYOLcOQxs,님들이 뭔데요....?,윤 정부라 기대 조차 안되는데...
호갱구조대,20220810,pOpYOLcOQxs,님들이 뭔데요....?,뭐긴뭐야 깡패 양아치 새끼들이지
호갱구조대,20220810,pOpYOLcOQxs,님들이 뭔데요....?,피아골 가보니 평상 따로 돈받는것같던데요?
호갱구조대,20220810,pOpYOLcOQxs,님들이 뭔데요....?,폐기물법을 더더욱 강화해서 인력배치하고 지자체장이 의지가 있으면 할 수 있는 문제..................
호갱구조대,20220810,pOpYOLcOQxs,님들이 뭔데요....?,"철거하고 관리자 두고 무조건 쓰래기 버리고가면 벌금100만원부터 시작하자!
쓰래기봉투 얼마한다고 쓰래기같은 새기들때문에 정리잘하고가는 사람까지 욕먹어! 닝길~"
호갱구조대,20220810,pOpYOLcOQxs,님들이 뭔데요....?,이재명이 잘한거도 있구나
호갱구조대,20220810,pOpYOLcOQxs,님들이 뭔데요....?,"불법인데 안없어진다? 정치인 뒷주머니랑 연관된 카르텔 사업임 이건 어쩔수 없음
쟤네들도 불법인거 알고 있는데 저렇게 당당하다는건 정부규모의 집단이 지들 응디 밀어주고 있는거 아니까 ^^ 그래서 렉카들도 당당한 이유가 이거죠"
호갱구조대,20220810,pOpYOLcOQxs,님들이 뭔데요....?,"왜 100만인지 알겠네, 어느 누구들이랑은 다르게 정확한 팩트로 휘둘러 패버리고 계시는..."
호갱구조대,20220810,pOpYOLcOQxs,님들이 뭔데요....?,우리나라에는 착한돈은 적은돈이고 나쁜돈은 많은돈일것이다.
호갱구조대,20220810,pOpYOLcOQxs,님들이 뭔데요....?,공무원이 더 타이트하게 관리해주셨으면 충분히 10년이란시간은 적은 시간은아니였을거다..
호갱구조대,20220810,pOpYOLcOQxs,님들이 뭔데요....?,"방관이 아니라 뒷돈 받고 넘어가주고 있었을 확률이 더 클듯 합니다.
무수한 민원이 들어 갈텐데 그냥 놔두고 있는걸 보면 뒷돈 찌르기 하고 있는듯 합니다."
호갱구조대,20220810,pOpYOLcOQxs,님들이 뭔데요....?,과태료 5억 때리고 단속하면 될껄...
호갱구조대,20220810,pOpYOLcOQxs,님들이 뭔데요....?,"강제철거 및 벌금부과와 철거비용 청구해야되고 재적발시 100배 과징금 및 부당이익 환수, 탈세 조사 추가해라"
호갱구조대,20220810,pOpYOLcOQxs,님들이 뭔데요....?,혹시 이재명 지지하는거 어니죠?^^
호갱구조대,20220810,pOpYOLcOQxs,님들이 뭔데요....?,불법사업장 주인들 정말 어이가 없네요. 우리나라의 시민의식도 많이 키워야 한다고 생각이됩니다.. 깔끔하고 정확하게 설명해주셔서 고맙습니다. 구독 박고 갑니다!
호갱구조대,20220810,pOpYOLcOQxs,님들이 뭔데요....?,100만 추카용
호갱구조대,20220810,pOpYOLcOQxs,님들이 뭔데요....?,"불법으로 돈을 벌고 있는데. 저게 허용되면, 범죄로 돈을 벌어도 합리화 되어버리죠."
호갱구조대,20220810,pOpYOLcOQxs,님들이 뭔데요....?,"이영상보고 앞으로당당히
계곡에 돗자리깔고 무료로 편히 쉬길바람"
호갱구조대,20220810,pOpYOLcOQxs,님들이 뭔데요....?,ㅋㅋㅋㅋㅋㅋ저건 봐 줄 필요가없음 가보신분들 아시겠지만 백숙이야 뭐 워낙 비싸게 받아쳐먹으니까 카드 받는곳도 있지만 평상비용?? 카드 받는 곳은 한번도 못 봄 세금도 안내는 그냥 불법 그자체
호갱구조대,20220810,pOpYOLcOQxs,님들이 뭔데요....?,"불법!
국가.국민의 배려가!
자신의 권리가 되어버렸네!"
호갱구조대,20220810,pOpYOLcOQxs,님들이 뭔데요....?,"얼마전 집안 어르신과 식구들이 모여서 가평쪽 계곡에있는 식당에갔는데 닭값에 평상값을 포함해서 받더라구요 95000원씩 근데 더웃긴건 계산할때 평상값 따로 더받고 밥먹을때,먹고나서 아이들과 물놀이를 하려하니 물놀이값을 내라하더군요 1인당2천원씩 계곡에 들어갈려면 돈을내랍니다 이게 무슨장난하는것도 아니고 어디서 닭한마리 삶고 95000원에 팝니까 그리고 잠깐 2-3시간 식사하는데 평상값을 따로 받으며 계곡에 들어갈려면 물놀이값을 지불해야한다??하천이 지들꺼인줄 아는것인지 하천 불법 점포들은 모조리 강제 철거 시키거나 징역을 때려줫으면 좋겟네요"
호갱구조대,20220810,pOpYOLcOQxs,님들이 뭔데요....?,아니 닭도리탕 백숙? 뭐 물놀이 하면배고프고 저런기름진 닭고기 땡기는것도 당연해 근데. ㅉㅂ 가격이 어느정도여야지 그래야 먹고놀던 먹고가던하지 원가 5천원~1만원짜리 닭을 최소 8~13만?? ㅋㅋㅋ 야야 적당히들해라 ㅋㅋㅋㅋㅋ
호갱구조대,20220810,pOpYOLcOQxs,님들이 뭔데요....?,양아치색들 싹다 망해야합니다.
호갱구조대,20220810,pOpYOLcOQxs,님들이 뭔데요....?,"매번 환경 외치면서 정작 환경을 신경쓰지 않는 무능하고 멍청하고 의지없고 그저 철밥통 지키려고만 하는 관련청들. 계속 국민신문고, 해당 청 등에 민원 넣는 것만이 답."
호갱구조대,20220810,pOpYOLcOQxs,님들이 뭔데요....?,공무원들 처벌하고..불법 영업 행위하는 곳 있음 신고 해서 신고 포상금 받게 해줘라. 소액이라도. 불법영업하는곳은  벌금 많이..
호갱구조대,20220810,pOpYOLcOQxs,님들이 뭔데요....?,"일단벌금부터왕창때리고 다음부터 하면 또
벌금문다 햇으면 세금수익이 수백억이겟다 ... 

신고시 배상금제도도딱이고 ㅋㅋㅋㅋㅋㅋ"
호갱구조대,20220810,pOpYOLcOQxs,님들이 뭔데요....?,같이 해먹은거지. 세금 한 푼 안내고 환경 오염에 경관망치고 이것들이 바로 도둑놈들이지. 도둑놈은 어떻게 처리한다? 죽도록 패고 전재산 몰수에 부당이득금환수 과징금까지. 그리고 빵에도 들어가 반성의 시간을 갖어야지.
호갱구조대,20220810,pOpYOLcOQxs,님들이 뭔데요....?,이영상에서 목소리가 유독 빡치신 것 같은데 착각인가ㅋㅋㅋㅋ
