Channel Name,date,videoId,titles,Comment
호갱구조대,20220810,pOpYOLcOQxs,님들이 뭔데요....?,이재명 경기지사가 강력히 단속해왔는데 경기지사 바뀌었다고 이것들 또 깔고있다네요 하천으로 아예 가지맙시다
호갱구조대,20220810,pOpYOLcOQxs,님들이 뭔데요....?,허재님 명대사 날려줘야되는데
호갱구조대,20220810,pOpYOLcOQxs,님들이 뭔데요....?,이런거는 각 지자체에서 관리하는 식당 개설해서 운영하면 되지않을까?
호갱구조대,20220810,pOpYOLcOQxs,님들이 뭔데요....?,"법보다 주먹이 앞서는 상황을
경험 못하신 영상이군"
호갱구조대,20220810,pOpYOLcOQxs,님들이 뭔데요....?,걍 가서 돈안내고 빈곳에 텐트치고 놀면됨ㅋㅋ쌩가고 놀면 아줌마가 욕짓거리하는데 같이 쌍욕박으면 아닥하고 다시 올라감
호갱구조대,20220810,pOpYOLcOQxs,님들이 뭔데요....?,"결론, 어처구니 없는 불법 영업장도 문제지만, 미개하기 그지 없는 시민 의식도 문제다."
호갱구조대,20220810,pOpYOLcOQxs,님들이 뭔데요....?,"불법영업 신고제 포상을 만들고 불법영업으로 인한 부당이득을 취할 시 부가세를 1000% 먹이는 법안이 나와야할것 같음.
구지 돌아댕기면서 철거해라 이런말 안해도 지들이 알아서 철거하지 않을까"
호갱구조대,20220810,pOpYOLcOQxs,님들이 뭔데요....?,던지 × 든지 ○
호갱구조대,20220810,pOpYOLcOQxs,님들이 뭔데요....?,제 ~ 발 본인이 가져온 쓰레기는 본인 집으로 가져갑시다.
호갱구조대,20220810,pOpYOLcOQxs,님들이 뭔데요....?,이재명이 도지사 내려가니까 또 늘어나고 있던데
호갱구조대,20220810,pOpYOLcOQxs,님들이 뭔데요....?,경기도 이재명 나가고 2022가 작년보다 더 늘어났다고 하네요. 지금 성수기가 지나지도 않았는데도 벌써 더 늘어났습니다. 지지표를 위해 백날 말로만 떠들게 아니라 시행할수 있는 지도자가 필요합니다.
호갱구조대,20220810,pOpYOLcOQxs,님들이 뭔데요....?,"ㅈㄹ한다 내 앞에 보이면 다 부순다
불법 자 색히들 특징은 조선족임"
호갱구조대,20220810,pOpYOLcOQxs,님들이 뭔데요....?,호갱구조대 이 남자랑 결혼한 여자는 부부싸움하면 말빨로 발리니까 복싱을배워서 아구창을 날리는 수밖엨ㅋㅋ
호갱구조대,20220810,pOpYOLcOQxs,님들이 뭔데요....?,피서는 경기도로 가면 되겠네.
호갱구조대,20220810,pOpYOLcOQxs,님들이 뭔데요....?,재명이형이 다 철거시킨거 아니였나
호갱구조대,20220810,pOpYOLcOQxs,님들이 뭔데요....?,내가가서  이새끼들이랑 싸운게 한두번이아님
호갱구조대,20220810,pOpYOLcOQxs,님들이 뭔데요....?,첫번째 이상인 ㅋㅋ 지금 장사 잘하고 있음
호갱구조대,20220810,pOpYOLcOQxs,님들이 뭔데요....?,아직도 저래??? 해당 지차체는 뭐하는 놈들인디?
호갱구조대,20220810,pOpYOLcOQxs,님들이 뭔데요....?,이재명씨가 이거 하나는 잘 밀었죠
호갱구조대,20220810,pOpYOLcOQxs,님들이 뭔데요....?,불법을 이용하지 않으면 저절로 망할 것입니다. 저도 계곡 불법이라고 안 이후 절대 안갑니다.
호갱구조대,20220810,pOpYOLcOQxs,님들이 뭔데요....?,"충분히 단속하고 철거할수있음에도
여태까지 안했던거네....
작년까지 전 이재명지사가 다 철거시켰었는데
철거 하려하니 불법저지르면서
영업하는 사장들 목에 핏대 세우고 저지하려하는거 잊혀지지않음"
호갱구조대,20220810,pOpYOLcOQxs,님들이 뭔데요....?,이재명이 한게 아니라 남양주 시장이 한거 이재명이 못질 한거아녀?
호갱구조대,20220810,pOpYOLcOQxs,님들이 뭔데요....?,백슉 먹자 했짜나!
호갱구조대,20220810,pOpYOLcOQxs,님들이 뭔데요....?,호갱구조대를 국회로!
호갱구조대,20220810,pOpYOLcOQxs,님들이 뭔데요....?,일부러 말빠르게 하는게 컨셉인지 모르겟는데 종나 듣기싫어서 한마디 쓴다  이거좋다고보는사람들이 신기하네 소음공해같은느낌
호갱구조대,20220810,pOpYOLcOQxs,님들이 뭔데요....?,"양날의칼이구만
 불법사업장이지만 알아서 환경 관리해주는"
호갱구조대,20220810,pOpYOLcOQxs,님들이 뭔데요....?,"왜 지금 윤석열이 대통령인지??
2찍 호구들아 잘 생각해봐라!!"
호갱구조대,20220810,pOpYOLcOQxs,님들이 뭔데요....?,"겁나 궁금한건데 저런곳에서 무전취식하면 어케될까
불법 평상 Vs 무전취식"
호갱구조대,20220810,pOpYOLcOQxs,님들이 뭔데요....?,진찌 한철장사해서 일년먹고 산다 라는말 제일 듣기 싫음 남들은 일년내내 일하는데...
호갱구조대,20220810,pOpYOLcOQxs,님들이 뭔데요....?,이렇게 말한다 해도 정부는 지금 비리관련해서 난리라 들어준다해도 다음 정권때 들어주겠네요
호갱구조대,20220810,pOpYOLcOQxs,님들이 뭔데요....?,계곡에 지자체에서 운영하는 캠핑장을 만드는게 현실성 있어보이네요
호갱구조대,20220810,pOpYOLcOQxs,님들이 뭔데요....?,벌금 부과해야하는데 지방공무원들은 돈받고 단속도 안하겠죠
호갱구조대,20220810,pOpYOLcOQxs,님들이 뭔데요....?,이재명씨가 유명한거알겠는데 그게  이재명씨만 한것도아니며 시작한것도 아님 따라한거뿐
호갱구조대,20220810,pOpYOLcOQxs,님들이 뭔데요....?,이재명 국회의원하지말고 포크레인과 불도저 끌고와주세요
호갱구조대,20220810,pOpYOLcOQxs,님들이 뭔데요....?,"구청장, 행정공무원 들의 친척들이거나, 친구들이거나, 선배거나, 동기거나, 후배거나, 기타 청탁 등등~ 아직도 한국은 원시 부락 국가임. 저냥반들 이승 하직 하지 않는한, 안없어짐~"
호갱구조대,20220810,pOpYOLcOQxs,님들이 뭔데요....?,국고도 모자른데 벌금 개 쎄게 때리고 시민신고은동 장려해야됨 소수로 인해 다수가 피해보는 중
호갱구조대,20220810,pOpYOLcOQxs,님들이 뭔데요....?,지도에 노란색..    이번선거 색같은데... ㄷㄷ
호갱구조대,20220810,pOpYOLcOQxs,님들이 뭔데요....?,그냥 계곡에 놀러가지마.한국인들은.
호갱구조대,20220810,pOpYOLcOQxs,님들이 뭔데요....?,그나마 이재명이 있어서 다행이지 ㅋㅋㅋㄱ 진짜 윤이나 나머지나 ㅋㅋㄱ
호갱구조대,20220810,pOpYOLcOQxs,님들이 뭔데요....?,ㅋㅋㅋㄱ 이런거 영상으로 나오면 뭐하누 여전히 판치는데
호갱구조대,20220810,pOpYOLcOQxs,님들이 뭔데요....?,이런 놈들은 그냥 다 밀어버려야 합니다.
호갱구조대,20220810,pOpYOLcOQxs,님들이 뭔데요....?,어휴 이재명 빠는거보고 구독취소합니다.  솔직히 별로 실속도 없는 채널이었음
호갱구조대,20220810,pOpYOLcOQxs,님들이 뭔데요....?,"옛날에 경기도지사가 없앤다고 하지않았나? 
다 보여주기식이었고만"
호갱구조대,20220810,pOpYOLcOQxs,님들이 뭔데요....?,"놀고 갈때 계산한다고 하고

먹튀 했던거 생각나네 ㅋㅋㅋㅋㅋ"
호갱구조대,20220810,pOpYOLcOQxs,님들이 뭔데요....?,진짜 지가 피해잔줄아네 가해자야 쓰레기새기들아
호갱구조대,20220810,pOpYOLcOQxs,님들이 뭔데요....?,이재명이 답이었다
호갱구조대,20220810,pOpYOLcOQxs,님들이 뭔데요....?,초등학교는 나왔냐 저 상인들
호갱구조대,20220810,pOpYOLcOQxs,님들이 뭔데요....?,이재명이 여의도로 입성하고난뒤 저 경기도 계곡에선 다시 저 불법 무지성들이 지들이 계곡에 주인인양 또 불법영업을 개시했다는데…어떤 사람이 그런 법을 집행할 의지와 남다른 실행력을 가졌는지 잘보고 투표하는것도 중요한듯하네요..
호갱구조대,20220810,pOpYOLcOQxs,님들이 뭔데요....?,니는 먼데 시민의식 운운하면서 가르칠라하노  니는 뭐되나?
호갱구조대,20220810,pOpYOLcOQxs,님들이 뭔데요....?,해변가도 이런거에 포함이 되는가요?
호갱구조대,20220810,pOpYOLcOQxs,님들이 뭔데요....?,장사하는 늠들이나 그걸 돈내고 먹는 늠들이나 창조경제다
호갱구조대,20220810,pOpYOLcOQxs,님들이 뭔데요....?,결론은 갓재명! 이재명이 대통령 됐으면 경기도가 바뀐 거처럼 우리나라가 바뀌었겠죠.
호갱구조대,20220810,pOpYOLcOQxs,님들이 뭔데요....?,"불가능하다 쓰레기 버리는 놈들을
불법 장사하는 놈들이 못따라갈듯"
호갱구조대,20220810,pOpYOLcOQxs,님들이 뭔데요....?,계곡상인들한테 뒷돈 많이 받으니 방관이죠 ^^
호갱구조대,20220810,pOpYOLcOQxs,님들이 뭔데요....?,경기도에 다시 설치 됐다는 sbs 뉴스 봤지....
호갱구조대,20220810,pOpYOLcOQxs,님들이 뭔데요....?,여태 범죄 저지른거 벌금쳐맞고 철거 해야하는데 저렇게 생각하는거면 저능아 아니냐?
호갱구조대,20220810,pOpYOLcOQxs,님들이 뭔데요....?,음식시켜야 계곡 들어갈수있다는건 ㄹㅇ 개골때리넼ㅋㅋㅋㅋㅋㅋㅋㅋ
호갱구조대,20220810,pOpYOLcOQxs,님들이 뭔데요....?,우리가 이용을 하지말아야 합니다.돈이되니 거머리처럼 생겨나는거 돈이 안되면 자연히 사라질 노양심업자들
호갱구조대,20220810,pOpYOLcOQxs,님들이 뭔데요....?,진짜 저런 불법사업자들 때문에 놀러가서 기분만 안좋아지더라구요^^
호갱구조대,20220810,pOpYOLcOQxs,님들이 뭔데요....?,"이재명 전지사 사퇴후 잠잠하니 다시 경기도 계곡에 불법 영업중....ㅡ.ㅡ;;; 정부는 뭐하고 쳐자빠져있는지..
해당 관련 공무원들 뒷돈 오지게 받아쳐먹나봄~~"
호갱구조대,20220810,pOpYOLcOQxs,님들이 뭔데요....?,계곡 불법영업장은 전부 강제 철거해버려야됨. 다 밀어버려야댐. 도둑놈들 범법자들
호갱구조대,20220810,pOpYOLcOQxs,님들이 뭔데요....?,저딴걸 구매하는 인간들이 제일 문제
호갱구조대,20220810,pOpYOLcOQxs,님들이 뭔데요....?,저거 이재명 하천전은 그냥 저 첫번째 아재가 캐리함 ㅋㅋ 죽닥치고있으면 반은 가는데
호갱구조대,20220810,pOpYOLcOQxs,님들이 뭔데요....?,계곡이 사유지인 곳도 드물지만 있다고 하던대 그런거는 어떻게 확인해야 하나요? 이번에 가족끼리 검태오남매라는 곳에 물놀이를 할려고 갔는데 계곡으로 가는 입구뿐만 아니라 계곡까지 사유지라고 돈내고 들어가야한다고 하더라고요... 주말이기도 해서 구청에 확인을 해볼 수도 없고 해서 1시간 넘게 걸려서 왔지만 어쩔 수 없이 다른 곳으로 갔어요....
호갱구조대,20220810,pOpYOLcOQxs,님들이 뭔데요....?,정말 짱짱 유익한 채널. 널리 널리 퍼져야 함.
호갱구조대,20220810,pOpYOLcOQxs,님들이 뭔데요....?,조선인이 중국욕하는것만큼 어이없는게 없음ㅋㅋ
호갱구조대,20220810,pOpYOLcOQxs,님들이 뭔데요....?,해운대 파라솔 강제 임대도 좀 조져라 칠성파 좀 조지바라 좀
호갱구조대,20220810,pOpYOLcOQxs,님들이 뭔데요....?,찢이 왠일..?
호갱구조대,20220810,pOpYOLcOQxs,님들이 뭔데요....?,계곡..찾아들어가기힘들고 모기겁나많고 누가토를했는지음식찌꺼기를버리는지 알수없지만 그래도 공짜로통제없이놀수있다는게 특장점인데 저런곳들이 그 특장점을 없앰. 그래서  빨리오갈수있고 정기소독하는 수영장이나 워터파크감. 계곡은 외갓집 다같이 휴가갈때나 가지.. 세대교체되면 더더욱발길끊길것. 황금알낳는오리배를가르는게이런거지
호갱구조대,20220810,pOpYOLcOQxs,님들이 뭔데요....?,이재명이 일 잘하긴 했네…
호갱구조대,20220810,pOpYOLcOQxs,님들이 뭔데요....?,"뇌물먹고 방관한거지 ㅎㅎㅎㅎㅎ 쟤네들 부가세든 종합소득세든 얼마를 냈을 것 같음?
현금장사하고 고객들 저런데 놀러가선 그냥 사장 개인계좌로 이체하고 현금영수증도 안끊으니 
매입이랑 또이또이 처리해서 부가세 안냈을거다.  환급액 나왔을수도 ㅎㅎㅎㅎㅎㅎ
관할국세청에서 털면 어마어마 할텐데 ㅎㅎㅎㅎㅎㅎㅎ
한철 장사해서 투자금 2억을 회수하는거면 손익분기 3달만에 넘긴건데
1년내내 일해서 먹고사는 사람들한테 너무하는거 아님?!"
호갱구조대,20220810,pOpYOLcOQxs,님들이 뭔데요....?,한국인들 더 까줘. 주제파악 못하고 중국만 욕하는 한국인들 팩폭때리면 카타르시스 느낌
호갱구조대,20220810,pOpYOLcOQxs,님들이 뭔데요....?,"불법 영업자 싸다구를 날리는데~
싸다구 날리고 손에 힘이 빠지는줄 알았으나
그옆에 히죽거리던 공무원 싸다구까지 같이 날라가니.. 우리는 그걸보고 박장대소하고 있는데 그 터진웃음중에 미쳐 예상치못한 마무리 싸다구 쳐맞고 얼빠져 있구나.."
호갱구조대,20220810,pOpYOLcOQxs,님들이 뭔데요....?,아니면 국가 자체에서 싸게 자리만 (음식영업×)예약제로 운영해서 나오는 수익금을 하천관리하는데 쓰던가 하면 안되나
호갱구조대,20220810,pOpYOLcOQxs,님들이 뭔데요....?,죄명이가 잘한거 딱하나가 저거긴한데..근데 그 마저도 대선노리고 한거지만ㅋ
호갱구조대,20220810,pOpYOLcOQxs,님들이 뭔데요....?,맞아요 저희동네 ㅎㅎ 계곡 쓰레기장됬어요 ㅎㅎ 그냥 계곡 눈탱이 받고 하던거를 정당한금액주고 팔고 관리 하게 권한을 주면 좋을거 같아요 눈탱이 요금이 문제였던거
호갱구조대,20220810,pOpYOLcOQxs,님들이 뭔데요....?,"구독자 100만을 바라보는 유투버는 다 이유가 있네요..  사이다를 안마셨는데도 1.5리터를 원샷한 기분입니다...  앞으로 200백만,  300백만이 되도록 더 열심히 수고해 주시고, 부디 우리 호갱들을 구조해 주세요.. ^^"
호갱구조대,20220810,pOpYOLcOQxs,님들이 뭔데요....?,이야 이재명이 이런걸 했었네
호갱구조대,20220810,pOpYOLcOQxs,님들이 뭔데요....?,벌금 때리지 말고 사장 종업원  징역 15년 때리면 하라고 해도 안하죠
호갱구조대,20220810,pOpYOLcOQxs,님들이 뭔데요....?,사형시키자
호갱구조대,20220810,pOpYOLcOQxs,님들이 뭔데요....?,경찰은 뭐하냐?
호갱구조대,20220810,pOpYOLcOQxs,님들이 뭔데요....?,우리나라가 관광대국이 될 수 없는 이유
호갱구조대,20220810,pOpYOLcOQxs,님들이 뭔데요....?,불도저로 싹다 밀어버려야된다 양아치새x들
호갱구조대,20220810,pOpYOLcOQxs,님들이 뭔데요....?,재매이햄이 전에 불법업자들 영혼까지 찢어버렸는데 ㅋㅋㅋㅋㅋㅋㅋ 더찢어주지 ㄲㅂ
호갱구조대,20220810,pOpYOLcOQxs,님들이 뭔데요....?,던지x 든지o
호갱구조대,20220810,pOpYOLcOQxs,님들이 뭔데요....?,별거없음 벌금 존나 쎄게 재정하면됨 ㅋㅋㅋㅋ
호갱구조대,20220810,pOpYOLcOQxs,님들이 뭔데요....?,윤석열이었음 설득 당해서 못한다에 한표
호갱구조대,20220810,pOpYOLcOQxs,님들이 뭔데요....?,더운 여름 시원하게 풀어주시네요 일따봉 드립니다
호갱구조대,20220810,pOpYOLcOQxs,님들이 뭔데요....?,1:32 표정 개씹상남자 그 자체노ㅋㅋ
호갱구조대,20220810,pOpYOLcOQxs,님들이 뭔데요....?,국제 호구 소리 안 듣는 한국만드는 방법 알려 주세요
호갱구조대,20220810,pOpYOLcOQxs,님들이 뭔데요....?,역시 이재명이 당대표가 되야하나 보군요
호갱구조대,20220810,pOpYOLcOQxs,님들이 뭔데요....?,이런거 보면 이재명 뽑는게 맞는데 찢 크흠...
호갱구조대,20220810,pOpYOLcOQxs,님들이 뭔데요....?,이재명 싫고 안찍엇지만 저런쓰래기근절은 잘햇다.
호갱구조대,20220810,pOpYOLcOQxs,님들이 뭔데요....?,계곡거지시발새끼들 다 나가뒤졌으면 ^오^~ 반박시 대깨
호갱구조대,20220810,pOpYOLcOQxs,님들이 뭔데요....?,불법이 난무한 나라가 되지않길ㅜㅜ 곧 계곡가는데 그 현장을 보겠네용..
호갱구조대,20220810,pOpYOLcOQxs,님들이 뭔데요....?,다른건 몰라도 이재명이가 저건 잘했다
호갱구조대,20220810,pOpYOLcOQxs,님들이 뭔데요....?,"비트코인같은녀석





구독자3천만명가즈아"
호갱구조대,20220810,pOpYOLcOQxs,님들이 뭔데요....?,재명이형이 그나마 이거 잘했는데 사라지니 개판이네요
호갱구조대,20220810,pOpYOLcOQxs,님들이 뭔데요....?,근절 하게 해야함!!!
호갱구조대,20220810,pOpYOLcOQxs,님들이 뭔데요....?,굿
호갱구조대,20220810,pOpYOLcOQxs,님들이 뭔데요....?,지금 다시 늘어나고 있음 윤석열 짱!!!!
호갱구조대,20220810,pOpYOLcOQxs,님들이 뭔데요....?,근데 당연히 정부는 비리하느라 바쁨...
호갱구조대,20220810,pOpYOLcOQxs,님들이 뭔데요....?,이재명 투입
호갱구조대,20220810,pOpYOLcOQxs,님들이 뭔데요....?,이재명 영상있지않나 정치적 댓글은 아니고 그때 이재명하고 토론펼치던 개씹 아재줌마들 불평 쏟아내는거 가관이였는대 ㅋㅋ 한철장사하는데 왜 못하게하느냐!! 우린 너무힘들다!! 쓰벌 한대 후려 갈려주고싶었음
호갱구조대,20220810,pOpYOLcOQxs,님들이 뭔데요....?,남양주시 조광한 시장이 먼저 밀어붙였고 당시 이재명 도지사가 경기도로 확산진행했음 이 과정에서 둘이 싸움남
호갱구조대,20220810,pOpYOLcOQxs,님들이 뭔데요....?,경기도는 그나마 수도권이니깐 자정능력이 있지만 거기서 더 벗어나면 지방자치가 고인물→썩은물화 되는 그림으로 돌아가기 때문에 국가레벨 특사경 광수대(?)같은 것이 뜨지 않는 이상 자정능력이 없다. 결국 매년 얼굴 붉히는 건 계곡명소에 놀러간 수도권 시민들이지........
호갱구조대,20220810,pOpYOLcOQxs,님들이 뭔데요....?,"500만원이상 1억 미만벌금으로
10진아웃제도 생기면
지역세금개이득"
호갱구조대,20220810,pOpYOLcOQxs,님들이 뭔데요....?,공무원들이 계곡 상인하고 결탁된 경우도 있겠지 이재명이야 저런 잔돈푼에 관심없고 엄청난 비리에 더관심있지 ㅋㅋㅋ
호갱구조대,20220810,pOpYOLcOQxs,님들이 뭔데요....?,개같이 처망해야지 ㅋㅋ
호갱구조대,20220810,pOpYOLcOQxs,님들이 뭔데요....?,이거 때려엎은거 아닌가요?? 아직도 이걸 유지하고있다니 ㅎㅎㅎㅎ 이재명 나와야겠네
호갱구조대,20220810,pOpYOLcOQxs,님들이 뭔데요....?,"불법이 맞는데 오히려 나는 반대임.
계곡가서 평상 7만원에사서 노는데 

거기 사장님들 장난아님 ㅋㅋ 
식당 이용안하면 다른 사람들 얼씬도 못하게 막아버리는데 그덕에 하천이 맑고 깨끗함 해수욕장처럼 사람이 넘쳐나서 북적북적 거리지도 않고 20테이블 정도 있는데 거기있는 사람이 전부임. 대충 5~60명정도?. 쓰레기도 하나도 없음. 자기들 밥벌어주는 곳인게 맞는듯 다치우고 관리를 하는데 참...ㅋㅋ 씁쓸하다 
가족 나들이 가서 집에서 해온 음식먹으면 좋지
문제는 무단 투기범들이 음식물 쓰레기 버려서 더러워질까봐 걱정
사람 엄청 많이 올꺼 같은데 음."
호갱구조대,20220810,pOpYOLcOQxs,님들이 뭔데요....?,"저런거 싹 쓸어버렸던 찢재명 이
그립긴하네요ㅡ.ㅡ"
호갱구조대,20220810,pOpYOLcOQxs,님들이 뭔데요....?,"노점상,,출처는,손쉽게,,하는데,,왜,,이런 불법은 산이고 강이라서??못하는걹가??는 철거는 왜 더딜까?ㅋㅋㅋㅋㅋㅋ불법 수입의 몇프로는 어디로 갓던걸까???"
호갱구조대,20220810,pOpYOLcOQxs,님들이 뭔데요....?,여름 한철 벌어서 일년을 먹고 산다는게 일년내내 열일하고 일년 먹고 사는 서민들에겐 박탈감과 혐오를 부추김
호갱구조대,20220810,pOpYOLcOQxs,님들이 뭔데요....?,저것들이 딸배랑 뭐가 다르냐 ㅋㅋㅋ
호갱구조대,20220810,pOpYOLcOQxs,님들이 뭔데요....?,참으로애미뒤진년들인것같습니다
호갱구조대,20220810,pOpYOLcOQxs,님들이 뭔데요....?,지난 영상들부터 슬슬 본인 정치관을 끼어넣네요? 답없네
호갱구조대,20220810,pOpYOLcOQxs,님들이 뭔데요....?,요즘 유튜브에서 많이 퍼진 국뽕유튜버들에 대한 이야기도 좀 해주세요.
호갱구조대,20220810,pOpYOLcOQxs,님들이 뭔데요....?,"저것 뿐이겟냐  할러고 하면
소년법 고치겟지 할생각 없지"
호갱구조대,20220810,pOpYOLcOQxs,님들이 뭔데요....?,이재명이 일 하나는 잘했었네
호갱구조대,20220810,pOpYOLcOQxs,님들이 뭔데요....?,"불법 상인들 간담회 영상으로 봤었는데
정말 기가 막히더라
범법자들을 자꾸 봐주니까 개 당당함
철거가 아니라 적발 즉시 사살해야 법 무서운줄 알지"
호갱구조대,20220810,pOpYOLcOQxs,님들이 뭔데요....?,"3:27 결론부터 이야기하면 전국에서 가장 먼저 하천ㆍ계곡 정비작업을 시작한 곳은 울산광역시 울주군이다. 울주군은 2017년 8월 불법 평상 30여곳 행정대집행을 통해 철거를 시작했다. 사실상 계곡정비 신호탄이고, 전국으로 확산되는 계기를 마련한 것이다.

골때리네 진짜. 형이 정치적으로 어느쪽인지 확실히 알겠지만, 사실 관계는 바로잡자. 본인이 양심적이라고 생각한다면 그렇게 하자. 자료조사 대충하지마. 지켜볼거야. 일부러 이재명 홍보하는거 아니면 영상 정정하고 제대로 올려라. 이게 지금 뭐하는 짓이야. 채널이 커져서 자료조사 다른놈한테 시키고 본인은 녹음만 하는게 아닌 이상 형이 이걸 발견하지 못할리는 없다고 보는데? 

시기상으론 이재명 전당대회 홍보용으로 올린 영상이라고 보여지네.

++ 형이 계곡 상인들을 지적할만한 양심적인 인간이라고 생각한다면 영상 내려.. 없을 것 같지만 일말의 양심이라도 존재한다면 그렇게 해. 내가 이런 태도 때문에 좌파들을 싫어해."
호갱구조대,20220810,pOpYOLcOQxs,님들이 뭔데요....?,감성팔이를 저떄 배웠나보군... 재명이가....
호갱구조대,20220810,pOpYOLcOQxs,님들이 뭔데요....?,"그럼 계곡가서 나가라고 누가 지랄하면 경찰불러! 한마디로 정리되겠네? ㅋㅋㅋㅋㅋㅋㅋㅋㅋ
사유지도 아니고 지들 마음대로 평상 쳐깔았으니"
호갱구조대,20220810,pOpYOLcOQxs,님들이 뭔데요....?,오늘 뉴스봤는데 다시 콘크리트 발라서 영업한다더라 ㅋㅋㅋㅋㅋㅋㅋㅅㅂ럼들
호갱구조대,20220810,pOpYOLcOQxs,님들이 뭔데요....?,저런 버러지들은 무슨깡으로 나라산림을 지네들사유재산 처럼 개소릴쳐해대지?
호갱구조대,20220810,pOpYOLcOQxs,님들이 뭔데요....?,"치산계곡 얼마전 다녀왔는데 사진에 나온 불법 사업장이 있더군요..계곡  중간에 평상이라니,,,,"
호갱구조대,20220810,pOpYOLcOQxs,님들이 뭔데요....?,진짜 헬조선답게 어질어질하다...관련자들 벌금 과태료등의 처분과 여태까지 번 부당이득을 환수하던 조세포탈혐의로 국세청에서 조사하든 처벌을 엄하게 해야할듯...윤석열 찍었지만 이재명의 이러한 점은 저도 인정하고 좋아합니다 윤대통령도 나머지 지자체들이 이와 같이 관리를 할 수 있도록 정부차원에서 노력해주셨으면 합니다
호갱구조대,20220810,pOpYOLcOQxs,님들이 뭔데요....?,호갱구조대님도 잘못알고계신거 있는데 이재명 이전에 남양주시 조광한시장이 시작하고 이재명의원이 따라한겁니다. 이건 이재명의원도 인정한거라... 그런데 조광한시장은 1도 언급안하시고 이재명만 언급하시네요... 남양주시민으로써 좀 찜찜하네요..
호갱구조대,20220810,pOpYOLcOQxs,님들이 뭔데요....?,공뭔들한테 알아서 앞뒤로 낭낭한 서비스를 챙겨주는데 관리가 될리가 없지
호갱구조대,20220810,pOpYOLcOQxs,님들이 뭔데요....?,저 상인새끼들은 강제철거 뿐 아니라 구속시켜야되는데ㅋㅋㅋㅋ오히려 뻔뻔하네ㅋㅋㅋㅋ
호갱구조대,20220810,pOpYOLcOQxs,님들이 뭔데요....?,그 '방관'에는 원인이있겠죠. 공무원들이 갈때마다 뒷돈 야무지게 자셨을거에요. 벌이도 괜찮겠다. 담당공무원 한둘 챙겨주는건 일도아니었겠죠.
호갱구조대,20220810,pOpYOLcOQxs,님들이 뭔데요....?,쓸어주세요 불도저로
호갱구조대,20220810,pOpYOLcOQxs,님들이 뭔데요....?,"벌금 50이 아니라 5천만원으로
올려봐라 그럼 세금도 걷고 굳이 철거인력 비용에다
세금 낭비할 필요도 없고 일 좀 편하게 해봐라"
호갱구조대,20220810,pOpYOLcOQxs,님들이 뭔데요....?,저기 영업주랑 같이 불태워버려야 한다.
호갱구조대,20220810,pOpYOLcOQxs,님들이 뭔데요....?,지지율 20퍼따리 병신들 또 쒸익쒸익 거리고있네 ㅋㅋ
호갱구조대,20220810,pOpYOLcOQxs,님들이 뭔데요....?,역시 이재명
호갱구조대,20220810,pOpYOLcOQxs,님들이 뭔데요....?,이런 양심없는 짓을 너무나 당당하게 하는 낯짝들을 보면 정말 내 손안의 주걱이 운다
