Channel Name,date,videoId,titles,Comment
호갱구조대,20220810,pOpYOLcOQxs,님들이 뭔데요....?,이재명이 떠나고 더 심해졌다는데…쥐새끼 같은 인간들…제발 노력해서 살아라
호갱구조대,20220810,pOpYOLcOQxs,님들이 뭔데요....?,범죄 저질러 놓고 감옥에 있다가 나왔으니 앞으로 살아갈 생계지원금 달라는 소리로 밖에 안들린다 ㅋㅋㅋ
호갱구조대,20220810,pOpYOLcOQxs,님들이 뭔데요....?,이재멍 빠는거임??
호갱구조대,20220810,pOpYOLcOQxs,님들이 뭔데요....?,언제적건데 지금 업로드 ㄷㄷ
호갱구조대,20220810,pOpYOLcOQxs,님들이 뭔데요....?,민족수준에 비해 너무 발전한 나라
호갱구조대,20220810,pOpYOLcOQxs,님들이 뭔데요....?,이야 호갱구조대님 진짜 멋잇다
호갱구조대,20220810,pOpYOLcOQxs,님들이 뭔데요....?,바퀴벌레들
호갱구조대,20220810,pOpYOLcOQxs,님들이 뭔데요....?,사업자들 하는 늘 하는 멘트  우린 한철 장사에요...!!!!  이 ㅈㄹ  그러면 딴거 하든가  배짱 장사 사기꾼들
호갱구조대,20220810,pOpYOLcOQxs,님들이 뭔데요....?,그냥 가서 돈내거 앉아야 한다하면 저희 삼촌 하천관리청에서 근무중이신데 전화해서 여쭤볼게요 하면 그냥 사라짐 이거 레알
호갱구조대,20220810,pOpYOLcOQxs,님들이 뭔데요....?,그럼 계고캠핑장 자리세 입장료받는것도 불법인가요? 계곡은 자기것이 아니라도 계곡 주변땅이 자신거라면 입장료 받고 자릿세받으며 장사하는건 어떻게되는건지 궁금하네요
호갱구조대,20220810,pOpYOLcOQxs,님들이 뭔데요....?,아직도 이런곳이 있나
호갱구조대,20220810,pOpYOLcOQxs,님들이 뭔데요....?,호의가 계속되면 ㅂㅅ인 줄 안다. 공짜로 점유하고 유료로 대여하고 사기꾼이 아니면 뭐냐 ㅋㅋㅋㅋ칼빵 안맞은거 다행인줄 알아야지
호갱구조대,20220810,pOpYOLcOQxs,님들이 뭔데요....?,"당연한 말이지만 사람들이 안가면 자연스럽게 사라질텐데 가는 사람들이 
꼭 있으니 유지가 되는거지.
찾아보면 지방에 한적한데 많음.
갈려면 그런데 가셈. 저런데가서 
아까운 돈 버리지 말고😥"
호갱구조대,20220810,pOpYOLcOQxs,님들이 뭔데요....?,"ㅋㅋ 장단점이 확실하네. 불법영업장이 쓰레기 청소는 어느정도 해주겠네. 킹치만 불법폐수는 마구 버릴걸? ㅋㅋㅋ
난 없애는쪽에 찬성!"
호갱구조대,20220810,pOpYOLcOQxs,님들이 뭔데요....?,"""한사랑산악회 김영남회장도 싫어한다는 그 곳"""
호갱구조대,20220810,pOpYOLcOQxs,님들이 뭔데요....?,3개월에 4천만원이면 할만한 장사네요
호갱구조대,20220810,pOpYOLcOQxs,님들이 뭔데요....?,인스타에서 계곡위에 평상 만들어놓고 인플루언서들 이용해서 홍보하길래 어이없어서 캡쳐해서 안전신문고에 신고했더니 바로 조치해주더라고요. 바로바로 신고가 답입니다. 참고로 경기도이긴했어요.
호갱구조대,20220810,pOpYOLcOQxs,님들이 뭔데요....?,청도 삼계리 계곡에서 당하고 이재명 철거 보고 속이 시원했어요
호갱구조대,20220810,pOpYOLcOQxs,님들이 뭔데요....?,찢 유일업적이라던 계곡 단속도 사실 전남양주시장이 한거 언론 불러와서 떠벌리고 실적 낼름한거.
호갱구조대,20220810,pOpYOLcOQxs,님들이 뭔데요....?,요약하면 모든 문제는 법의 구멍때문이거나 공무원들이 단속하지않아 벌어진 일이라는거네..이번사건만큼은 찢 지지한다
호갱구조대,20220810,pOpYOLcOQxs,님들이 뭔데요....?,그냥 한국인이 문제라는건가.. 죄의식없는 불법업주나 시민의식없는 캠핑족이나 다 결국 한국인..
호갱구조대,20220810,pOpYOLcOQxs,님들이 뭔데요....?,이재명이 인물은 인물이다. 다른 지자체에서 10년동안 손도 못댄것을 2년 만에 해결하다니.... 👍
호갱구조대,20220810,pOpYOLcOQxs,님들이 뭔데요....?,남양주시장이한거 뺏은걸 아직도 믿는사람이 있구만
호갱구조대,20220810,pOpYOLcOQxs,님들이 뭔데요....?,"결국엔 공무원들이 일을 안하는게 문제인거지 
ㅋㅋㅋㅋㅋㅋㅋㅋ"
호갱구조대,20220810,pOpYOLcOQxs,님들이 뭔데요....?,한바다에 의뢰하면 우영우가 남방큰돌고래와 함께 해결해줌
호갱구조대,20220810,pOpYOLcOQxs,님들이 뭔데요....?,하천을 니들이사서 영업해라 양아치들
호갱구조대,20220810,pOpYOLcOQxs,님들이 뭔데요....?,이근안 선생님이 있어야 저짓을 못한다
호갱구조대,20220810,pOpYOLcOQxs,님들이 뭔데요....?,내가 이거때매 이재명 뽑았는데 지금은 왠 아저씨가 용산에서 출퇴근하는 거나 보고있고 ㅎ
호갱구조대,20220810,pOpYOLcOQxs,님들이 뭔데요....?,근데 나는 저렇게 강제적인곳은 못보고 대부분 계곡 옆에 평상이나 식당있고 텐트 치고 싶음 치고 사먹고 싶음 사먹고 계곡 들어가고 싶음 들어가는 거였는데.. 참고로 우리 가족은 매 년 두 세 번씩 계곡 다녔었음
호갱구조대,20220810,pOpYOLcOQxs,님들이 뭔데요....?,이재명이가 했단다. 범죄자 빠는새끼들.ㅋㅋ
호갱구조대,20220810,pOpYOLcOQxs,님들이 뭔데요....?,다 조져야돼
호갱구조대,20220810,pOpYOLcOQxs,님들이 뭔데요....?,이재명 일 잘하농
호갱구조대,20220810,pOpYOLcOQxs,님들이 뭔데요....?,이거보니까 경기말고 다른대서 계곡장사나하면되겠네ㅋ
호갱구조대,20220810,pOpYOLcOQxs,님들이 뭔데요....?,"할 려는 의지가 없는 것이지 시간이나 인력이 없어서가 아니다.
결국은 행정수장이 누구냐에 따라 국민들의 복지가 달라지는 것이다."
호갱구조대,20220810,pOpYOLcOQxs,님들이 뭔데요....?,좋은 정보네요 넣어놔야겠다
호갱구조대,20220810,pOpYOLcOQxs,님들이 뭔데요....?,불법 영업하는 영업장을 쫒아내고 강제 철거했더니 그 다음날 와서 계곡에 유리병을 엄청 깨놓고 깽판친 ㅅㅋ도 있었죠.
호갱구조대,20220810,pOpYOLcOQxs,님들이 뭔데요....?,시발 등기부등본 가져와봐
호갱구조대,20220810,pOpYOLcOQxs,님들이 뭔데요....?,이건 찢이 잘했네ㅋㅋ
호갱구조대,20220810,pOpYOLcOQxs,님들이 뭔데요....?,정착지원금?ㅋㅋㅋ 옛날 불법점거하던 용산 철거민이 생각나네요.. 우리나라는 법치국가입니다. 뻔뻔한 불법자들은 정말 꼴보기 싫음
호갱구조대,20220810,pOpYOLcOQxs,님들이 뭔데요....?,저런게 계곡만 있는지도 모르겠네
호갱구조대,20220810,pOpYOLcOQxs,님들이 뭔데요....?,이거 남양주시장이 한걸로 아는데
호갱구조대,20220810,pOpYOLcOQxs,님들이 뭔데요....?,이재명 짱
호갱구조대,20220810,pOpYOLcOQxs,님들이 뭔데요....?,"역시나 자랑스러운 대한민국 사람들 저 업자들도 문제지만 쓰레기 버리는 우리 시민의식도 문제인데 아무도 그 소린 안하네
평생 이리 살다 망할 갓한민국"
호갱구조대,20220810,pOpYOLcOQxs,님들이 뭔데요....?,얼마전에 계곡갔는데 계곡내려갈라고 가게앞에 지나가니깐 그쪽으로 지나가지말라더라 ㅋㅋ 뭔 ㅂㅅ같은경우를 다보겠네
호갱구조대,20220810,pOpYOLcOQxs,님들이 뭔데요....?,해수욕장 평상이나 테이블 설치도 불법인가요?
호갱구조대,20220810,pOpYOLcOQxs,님들이 뭔데요....?,정보 : 계곡 강제철거 정책은 남양주 시장이 추진하고 있었으나 경기지사 이재명이 자기가 거느리는 도의 산하에 있는 지자체장의 공약을 도둑질해서 본인이 생색은 다내고 남양주 시장이 항의하자 누가했든 해야할일 하기만 하면 된거 아니냐며 같은 정당소속 시장 찍어누르기에 들어가며 남양주 시 예산을 삭감하는 등 치졸한 모습을 보여줌
호갱구조대,20220810,pOpYOLcOQxs,님들이 뭔데요....?,인간도 아닌 쓰레기들입니다
호갱구조대,20220810,pOpYOLcOQxs,님들이 뭔데요....?,예전에 깡패들 모아서 잡아넣었듯이 맘 먹고 잡아들이면 됨. 일본 야쿠자 외국 마피아 중국 삼합회들 아직까지 짱짱한데 우리나라 깡패... 영화에나 나오지 별볼일 없잖아
호갱구조대,20220810,pOpYOLcOQxs,님들이 뭔데요....?,"수영장 계곡쪽에 있는대는 20년전에도10만원이 넘었다  나는 합법적인 그들이라도? 꼴보기싫어   지금 나오는  불법,?백숙장에가서  음식은 필요없고 5만원  줄테니까  물에 좀 들어가자 했다
난 내방법이 가장 안 호갱이라고 본다
둘이 물속에서 더위를 자알 피하고 5만원
냈지
불법인것 누가 모르나    고발하려면  내시간 뺏기고  합법적인!? 계곡수영장보다 덜밉고   왜 고발하겠어"
호갱구조대,20220810,pOpYOLcOQxs,님들이 뭔데요....?,당시 이재명 도지사가 없앴지만 지금 다시 조금씩 생긴다고 하더군요. 도로아미타불 되가고있음. 신경 쓰는 사람만 신경쓰지 나머진 신경 안씀.
호갱구조대,20220810,pOpYOLcOQxs,님들이 뭔데요....?,빨리 계곡에 닭집이랑  바다에 파라솔들 없어지라고
호갱구조대,20220810,pOpYOLcOQxs,님들이 뭔데요....?,특유의 긴박하게 브리핑하는듯 한 편집이 이 채널의 신의 한수 입니다 ㅋㅋㅋㅋㅋㅋㅋ
호갱구조대,20220810,pOpYOLcOQxs,님들이 뭔데요....?,공무원 넘칠텐데 ㅋㅋ 그저 작은 짱
호갱구조대,20220810,pOpYOLcOQxs,님들이 뭔데요....?,이재명이 필요하겟네
호갱구조대,20220810,pOpYOLcOQxs,님들이 뭔데요....?,하 안타깝다.. 지금 윤석열 정부에다 뭘바라겟노.. 지그들끼리 처싸우느라 개바쁜대 ............. 이것도 바뀔려면 5년이후 겟내... 2027년까지 방관 예정임
호갱구조대,20220810,pOpYOLcOQxs,님들이 뭔데요....?,한철장사로 등쳐먹는거라 애초에 밥벌이를 할 그게 아닐텐데 투자금 회수를 두달만에 하는 수준 ㅋㅋㅋㅋ 와 정말
호갱구조대,20220810,pOpYOLcOQxs,님들이 뭔데요....?,"저불법상인들 대부분이 조선족들인데 장사가 잘되어서 연변 가족,친척들 다 데려와서 장사한다함"
호갱구조대,20220810,pOpYOLcOQxs,님들이 뭔데요....?,ㅋㅋㅋㅋㅋ 범죄자들이 말이 많네
호갱구조대,20220810,pOpYOLcOQxs,님들이 뭔데요....?,"이재명 없으니
다시 슬슬 기어나오네
기생충같은 ㅆㅂㅅㄲ들

이재명이 이거는 잘했는데
노빠꾸로 확 밀어버린거"
호갱구조대,20220810,pOpYOLcOQxs,님들이 뭔데요....?,이거 걷어냈다더니.. 성남지역 외 타지역에선 아직 성행중 인가 보네..ㅉ
호갱구조대,20220810,pOpYOLcOQxs,님들이 뭔데요....?,대구 청도 이런데도 다 조져야함 싸가지도 없고
호갱구조대,20220810,pOpYOLcOQxs,님들이 뭔데요....?,이런거보면 또 재명치트키 마렵네요
호갱구조대,20220810,pOpYOLcOQxs,님들이 뭔데요....?,"어이없던게 한철장사해서 투자한거 뽑는다는게 신기하더라
얼마나 폭리를 취한다는거야 ㅋㅋㅋ 그리고 계곡이 지들꺼임 ???
진짜 계곡주위 불법 건축물이나 구조물 싹다 철거해야지 
철거하는것도 돈드는데 청구하고"
호갱구조대,20220810,pOpYOLcOQxs,님들이 뭔데요....?,개빡치는건 이런걸 보고도 저런곳을 가서 좋다고 인스타에 올리는 몰상식한 시민들이 아닌가 생각되네요.
호갱구조대,20220810,pOpYOLcOQxs,님들이 뭔데요....?,그래서 일잘하는 유능한 정치인이 필요한거다
호갱구조대,20220810,pOpYOLcOQxs,님들이 뭔데요....?,예전에 가족이랑 계곡갔다가  저런똑같은짓해서 바로 시청에 고발함    그후 시청에서  그계곡장사하는애들 싹정리해버림
호갱구조대,20220810,pOpYOLcOQxs,님들이 뭔데요....?,공무원들 탱자탱자 놀쥬?
호갱구조대,20220810,pOpYOLcOQxs,님들이 뭔데요....?,"시민의식이 불법이네
쓰레기버리는사람을 징역보내야"
호갱구조대,20220810,pOpYOLcOQxs,님들이 뭔데요....?,가지마..가지마..이 호구들아
호갱구조대,20220810,pOpYOLcOQxs,님들이 뭔데요....?,신고 당할 때마다 벌금 물게 해야함
호갱구조대,20220810,pOpYOLcOQxs,님들이 뭔데요....?,무식한 사람이 신념을 가지면…..?!!
호갱구조대,20220810,pOpYOLcOQxs,님들이 뭔데요....?,"니는 얼마나 개념있길래 이 나라의 시민의식을 교육하라는 소리를 하노.....;
니 가족은 이 나라 시민 아니냐? 에휴;;;  
어느나라든 관리 안 하면 엉망인 건 똑같음. 당연히 관광지로서 내세울 거면 그에 걸맞는 관리도 해야지"
호갱구조대,20220810,pOpYOLcOQxs,님들이 뭔데요....?,ㅋㅋㅋ개씨벌놈들임ㅋㅋㅋㅋㅋㅋㅋ
호갱구조대,20220810,pOpYOLcOQxs,님들이 뭔데요....?,"시민의식이 성숙하지못했다.
이게 맞다.. 시민의식이 성숙했다면 계곡 불법점거하고 피해자코스프레 하는것도 없었을것이고 차박유행때 지역발전은 거의 없다시피 쓰레기장만 된거보면 거진 확실하다..
발전된 경제에 비해 발전되지못한 시민의식이 보여주기식 좋아하는 물질만능주의 경쟁사회였기에 이런게 나아지려면 상당히 오래걸릴것같다고 생각함"
호갱구조대,20220810,pOpYOLcOQxs,님들이 뭔데요....?,"재명이가 저런 걸 했었네
ㅋ 가지가지하네"
호갱구조대,20220810,pOpYOLcOQxs,님들이 뭔데요....?,아직도 이런곳이 있나요?? 에휴 ㅡ.ㅡ
호갱구조대,20220810,pOpYOLcOQxs,님들이 뭔데요....?,역시 이재명 화이팅입니다 ~^^
호갱구조대,20220810,pOpYOLcOQxs,님들이 뭔데요....?,4대강 반대단체나 그린피스는 뭐한대요? 왜 저런데서 저런거하는거 신고때리고 시위안하는지?
호갱구조대,20220810,pOpYOLcOQxs,님들이 뭔데요....?,몇명싸잡아서 징역 10년박아둬~~
호갱구조대,20220810,pOpYOLcOQxs,님들이 뭔데요....?,이걸 잡은게 이재명이었는데 이재명에게 국민들 죽인다는 개소리나 하다가 지금 울나라 이꼴남 ㅋㅋㅋㅋㅋㅋ 2찍들의 작품이지~
호갱구조대,20220810,pOpYOLcOQxs,님들이 뭔데요....?,계곡 안가면됩나다 계곡 아웃입니다 이제
호갱구조대,20220810,pOpYOLcOQxs,님들이 뭔데요....?,"사유지로 통과해서 개울로 입장할수 없으니 지자체에서 개울로 들어갈수 있는 계단을 만들어 주면 좋을듯 한데요.. 
상가피해서 옆으로  애들데리고 개울로 들어갈라고 풀 헤집으면서 들어가다 뱀 나와서 놀랬다는..."
호갱구조대,20220810,pOpYOLcOQxs,님들이 뭔데요....?,2찍은놈들 손모가지 짤라야함.
호갱구조대,20220810,pOpYOLcOQxs,님들이 뭔데요....?,너무 신사적으로 나간거임 아니 호구처럼 나갔다해야 하나? 벌금이아니라 그동안 벌엇떤거 추징해서 전제산 뺏었어야지 . 안그러니 정신못차리고 저ㅗ런 ㄱ소리나 하고 앉아있지
호갱구조대,20220810,pOpYOLcOQxs,님들이 뭔데요....?,경기도는 되는데 다른지역은 왜?
호갱구조대,20220810,pOpYOLcOQxs,님들이 뭔데요....?,"이래서 이재명이 좋았는데, 이런거빼면 ㅂㄹ이라ㅜ"
호갱구조대,20220810,pOpYOLcOQxs,님들이 뭔데요....?,"국개들.... ..
 ..뒤져라"
호갱구조대,20220810,pOpYOLcOQxs,님들이 뭔데요....?,죽여라 세금충들.
호갱구조대,20220810,pOpYOLcOQxs,님들이 뭔데요....?,돈주고 봐주는 공무원 개시키들 다 잡아넣어야댐
호갱구조대,20220810,pOpYOLcOQxs,님들이 뭔데요....?,이재명이가 불도저로 밀어버린. 이재명 떠나고 다시 돈주고 들가야하나보네 ㅎㅎ
호갱구조대,20220810,pOpYOLcOQxs,님들이 뭔데요....?,푸핫...너무  4  가지가 없어서 웃음이..ㅋ 하천이 자연꺼지 니들은 뭐냐.. 호갱구조대..그는 도덕책
호갱구조대,20220810,pOpYOLcOQxs,님들이 뭔데요....?,찢갈이들 저때 많이 늘었지
호갱구조대,20220810,pOpYOLcOQxs,님들이 뭔데요....?,"방관속에  우리나라  자연이 병들어간다
이재명같은 양반이 많아야 하는데 다들 지 밥그릇   챙기기에 바쁘다보니 고스란이  시민들이   그  피해를  당하고 있네   버리는 놈들 따로 있고  방관하는   놈들은 수두룩하고   중국 욕할게 아니네  우리나라 사람들 계곡가면 쓰레기좀 버리지말어  더럽고 냄새나 미치것다"
호갱구조대,20220810,pOpYOLcOQxs,님들이 뭔데요....?,화난다 .. 저사람들 무시하고 자리 깔면 어떻게되는지궁금하네
호갱구조대,20220810,pOpYOLcOQxs,님들이 뭔데요....?,"이재명이 구설수가 많아도 인기있는 이유 중 하나가 바로 이런 빠꾸없는 모습때문임. 국민들이 나랏님들한테 바라는건 많은게 아님. 불법으로 시민들 등쳐먹는인간들 혼내주고, 시민들생활에 불편함없게 발벗고 나서주는거 일거임. 최근경기도도 이재명 나가고 다시 불법영업 시작하고있다던데, 언제쯤 제대로된 지자체장들이 나올지"
호갱구조대,20220810,pOpYOLcOQxs,님들이 뭔데요....?,계곡이 지껀듯
호갱구조대,20220810,pOpYOLcOQxs,님들이 뭔데요....?,염전노예도 아직도 안사라지는것도 다루어주세요
호갱구조대,20220810,pOpYOLcOQxs,님들이 뭔데요....?,실제로 가서 찍은 줄 알앗음
호갱구조대,20220810,pOpYOLcOQxs,님들이 뭔데요....?,그냥 업장 돈받고 관리잘하면 놔둬라.금방 쓰레기장된다. 국민성이 개돼지라.
호갱구조대,20220810,pOpYOLcOQxs,님들이 뭔데요....?,"얼굴은 뭐하러 가려 두고두고 회자되게
길거리 다니다 돌팔매 맞게 보여주지
누군지 대번 알겠고만"
호갱구조대,20220810,pOpYOLcOQxs,님들이 뭔데요....?,펜션에 딸린 계곡은 펜션이용자만 이용하라는데 이거 불법맞나요?
호갱구조대,20220810,pOpYOLcOQxs,님들이 뭔데요....?,"그래도 제목이 착하네
니들이 뭔데요 지ㅋㅋ"
호갱구조대,20220810,pOpYOLcOQxs,님들이 뭔데요....?,영상 취지는 공감하나 공무원 추가 채용은 반대합니다
호갱구조대,20220810,pOpYOLcOQxs,님들이 뭔데요....?,이재명이 잘했네
호갱구조대,20220810,pOpYOLcOQxs,님들이 뭔데요....?,자자. 지방의 문제점 소개. 대부분의 계곡과 해변가를 자기것 마냥 사용하고 장사하는 사람들을 왜 단속하기 힘든가? 그거 하는 사람들 대부분 지역 청년회와 연결되어 있어. 청년회가 뭐하는 곳일까? 지역의 이익을 위해 행동하는 조직이야. 강력한 투표권을 행사하고 정치인 후원도 빵빵하지. 대부분의 정치인들은 그들의 위법을 알아도 손대지 못해. 후원금 및 뒷돈 끊기고 다음선거도 위험하지. 청년회는 그 힘으로 카르텔을 형성해. 실제로 외부인이 본인도 장사하려 들어오면 청년회의 공격을 받아. 요즘세상에도 일어나는 일이야. 그러니 불법인데도 하고자 하면 권리금 명목의 관리비를 청년회에 납부해야해. 그게 다시 정치인 호주머니에 들어가고. 저런 지역 불법관광지를 절대 몰아내지 못하는 이유야. 정치인은 지역 관광지 상인들 절대 못밀어내. 그러니 이재명이 대단한거야. 표팔이 할려고 쑈한거다? 암것고 모르는 말이야. 이재명을 좀 믿어봐. 대단하고 용기있는 일인거라고.
호갱구조대,20220810,pOpYOLcOQxs,님들이 뭔데요....?,경기도는 이재명때 없어진거 아니었나?
호갱구조대,20220810,pOpYOLcOQxs,님들이 뭔데요....?,이재명 간담회때 첫번째 인터뷰한놈이 지존이다ㅋㅋㅋㅋㅋ
호갱구조대,20220810,pOpYOLcOQxs,님들이 뭔데요....?,??? : 백숙먹자했잖아!!
호갱구조대,20220810,pOpYOLcOQxs,님들이 뭔데요....?,놀곳이 없다. 뭔 관광지 가면 돈이고 대한민국땅을 대한민국 국민이 돈을 내고 봐야되 ㅅㅂ
호갱구조대,20220810,pOpYOLcOQxs,님들이 뭔데요....?,백슉묵자했자나
호갱구조대,20220810,pOpYOLcOQxs,님들이 뭔데요....?,다른 지역? 괜히 엄하게 상인들한테 반감사고 표 떨어질까봐 절대 단속 안합니다.
호갱구조대,20220810,pOpYOLcOQxs,님들이 뭔데요....?,저것때문에 이재명이라면 이빨갈고 쌍욕하는 인간들 있지 ㅋㅋㅋ
호갱구조대,20220810,pOpYOLcOQxs,님들이 뭔데요....?,불매해야하는대 ㅋㅋ호갱처럼 이용하는 사람들 있어서 안망하는거 ㅋㅋ
호갱구조대,20220810,pOpYOLcOQxs,님들이 뭔데요....?,방관한거 맞지...뒤에서 돈 받고...공무원 회식 저기서 하고...공무원 가족들은 거의 무료로 먹고...
호갱구조대,20220810,pOpYOLcOQxs,님들이 뭔데요....?,저새끼들하고는 말싸움 해봐야 막무가내라서 피곤만함 그냥 경찰에 신고하면됨 말로 해서 안되는 새끼들은 법대로 하는게 약임
호갱구조대,20220810,pOpYOLcOQxs,님들이 뭔데요....?,역시 소시오패스답게 시원하게 밀어버림~
호갱구조대,20220810,pOpYOLcOQxs,님들이 뭔데요....?,우와랩해도되겠어요
호갱구조대,20220810,pOpYOLcOQxs,님들이 뭔데요....?,사기꾼 들의 행위. 고발해야 한다. 이재명 지사 할땐. 깔끔 했는데.  .
호갱구조대,20220810,pOpYOLcOQxs,님들이 뭔데요....?,이 나라개선하는거보다 아프리카를 세계최고급의 농경지로 개척하는게 더 현실성있을듯
호갱구조대,20220810,pOpYOLcOQxs,님들이 뭔데요....?,벌금 몇억씩물어야지
호갱구조대,20220810,pOpYOLcOQxs,님들이 뭔데요....?,이재명지사님 시절 계곡 철거 회의할때   급발진했던  미친인간이 저러고 산거임
호갱구조대,20220810,pOpYOLcOQxs,님들이 뭔데요....?,이재명의원이 경도지사 물러나고 지금 다시 공무원들 방관하고 있어서 다시 계곡 불법 음식장사 하는 생퀴들 활기치고 있다네요 ㅎㅎㅎ
호갱구조대,20220810,pOpYOLcOQxs,님들이 뭔데요....?,애당초 불법을 저지른 인간들이 도대체 철면피를 몇겹을 처 둘럿길래 저리도 뻔뻔할수가잇냐 되려 적반하장에 저개새끼들이 주장하는게 어느나라 이치냐? 존나진짜 상상초월 회궤한개소리를 늘어놓네
호갱구조대,20220810,pOpYOLcOQxs,님들이 뭔데요....?,뱩슉먹자 햬쨔냐
호갱구조대,20220810,pOpYOLcOQxs,님들이 뭔데요....?,이재명 물러나니까 바로 스물스물 기어오르는거봐라
호갱구조대,20220810,pOpYOLcOQxs,님들이 뭔데요....?,"이재명이니까 밀어붙힌거지 
자기 표 떨어지까봐 관리 안하는게 한국 정치인들의 현실.."
호갱구조대,20220810,pOpYOLcOQxs,님들이 뭔데요....?,아니 이형 목소리 정말 친근하고 좋네
호갱구조대,20220810,pOpYOLcOQxs,님들이 뭔데요....?,"갈데가 그렇게없나
안가면 자연히없어진다"
호갱구조대,20220810,pOpYOLcOQxs,님들이 뭔데요....?,이재명이지~
호갱구조대,20220810,pOpYOLcOQxs,님들이 뭔데요....?,ㅋㅋㅋㅋㅋㅋ 한가지 알게된건 군주도 경찰도 다 뒷돈 받아감
호갱구조대,20220810,pOpYOLcOQxs,님들이 뭔데요....?,이재명이 아무리 욕을 먹는다고 하지만 ㄹㅇ 쓰레기 업자 계곡 철거 해버리는 추진력은 박수 받아야 됨 지들이 뭔데 계곡에서  계곡 들어가는 사람한테 돈을 받는 양아치 쓰레기만도 못한 것들 ㅋㅋ 어짜피 나는 계곡을 안가는데 저런 벌레만도 못한 ㅅㄲ들 때문에 더 안가게 됨
호갱구조대,20220810,pOpYOLcOQxs,님들이 뭔데요....?,"하나 집고 넘어가자면 계곡정비사업은 이재명이 처음 시작한게 아니라 남양주시장이 시작해서 반응이 좋으니 이재명이 따라한겁니다!
계곡정비사업으로 문재인대통령상을 받은건 남양주시장입니다"
호갱구조대,20220810,pOpYOLcOQxs,님들이 뭔데요....?,좌파친북 유튜버였노?
호갱구조대,20220810,pOpYOLcOQxs,님들이 뭔데요....?,이재명 지사가 일은 잘했음.
호갱구조대,20220810,pOpYOLcOQxs,님들이 뭔데요....?,닭 큰거 쓰지말고 작은거 한 세마리 넣어서 끓여줘라 훨씬 싸겠네 정착 지원금 ㅋㅋㅋ 지금까지 번건 생각안하네
호갱구조대,20220810,pOpYOLcOQxs,님들이 뭔데요....?,법이 약해서 그래..
호갱구조대,20220810,pOpYOLcOQxs,님들이 뭔데요....?,시민의식은 고쳐지지 않을겁니다 문화를 보면 그나라의 국민성을 알수 있죠..
호갱구조대,20220810,pOpYOLcOQxs,님들이 뭔데요....?,"이거 이재명이 경기도지사때 계곡 불법영업 싹 다 철거하고 방안까지 마련해줬었는데 이번에 도지사 바뀌고 다시 스멀스멀 다시 기어나오는 중 국공사유지인 계곡은 외적인 미화는 물론, 자연환경은 오염되고 뭐 하는짓인지 대체"
호갱구조대,20220810,pOpYOLcOQxs,님들이 뭔데요....?,대장동   옆구리  터지는  소리하고 있네
호갱구조대,20220810,pOpYOLcOQxs,님들이 뭔데요....?,그냥 무시하고 안사먹고 놀면 돼는데 비싼돈 주고 달라는대로 주는 호구들 때문에 안없어지는거지
