Channel Name,date,videoId,titles,Comment
호갱구조대,20220810,pOpYOLcOQxs,님들이 뭔데요....?,"애들 능지가 왜케 낮냐? 이재명 싫어하는 건 알겠는데, 남양주시장이 먼저했든 울산시장이 먼저했든 경기도 단위로 사업진행한건 이재명이잔아. 
남양주시장이 경기도 계곡평상 다 뜯어낸거냐고... 정책에 저작권 붙어있음? 서울에서 교통카드 환승 먼저했으면 부산에서 시행한것도 이명박이 한거야??
차라리 전과4범으로 까는건 이해라도 하지 ㅋㅋㅋㅋㅋㅋㅋㅋㅋ"
호갱구조대,20220810,pOpYOLcOQxs,님들이 뭔데요....?,이영상만큼은 추천드립니다!!!!
호갱구조대,20220810,pOpYOLcOQxs,님들이 뭔데요....?,과태로를 5억원으로 올리고 못낸다고 하면 강제추징한다고 법 바꿔봐라. 절대 못할걸?
호갱구조대,20220810,pOpYOLcOQxs,님들이 뭔데요....?,벌금 50~100이니깐 게속 배째고 장사하지 ㅋㅋㅋ 하루에 1번씩 벌금내게 해야함 그럼 장사 못하겟지 하루에 1번씩 신고 ㄱㄱㄱ
호갱구조대,20220810,pOpYOLcOQxs,님들이 뭔데요....?,"지자체 묵인 없이는 불가능
누군가는 연결책이 있음"
호갱구조대,20220810,pOpYOLcOQxs,님들이 뭔데요....?,다 부셔버린줄 알았는대 아직도 저런곳이 남아있네
호갱구조대,20220810,pOpYOLcOQxs,님들이 뭔데요....?,상인들 말 참 주옥같이 한다..ㅎ
호갱구조대,20220810,pOpYOLcOQxs,님들이 뭔데요....?,이재명의 작두위의 칼춤을 다시 보고 싶다...........
호갱구조대,20220810,pOpYOLcOQxs,님들이 뭔데요....?,이번건은 이미 뒷북 끝나고 올라왔다.......
호갱구조대,20220810,pOpYOLcOQxs,님들이 뭔데요....?,"얼굴에 철판깔고 들어가있으면 된다는건가
뭐 덩치좋은 형님들이랑 같이 가야되면 되는겨?"
호갱구조대,20220810,pOpYOLcOQxs,님들이 뭔데요....?,불법으로 계곡장사하는 새키들은 부모가 없나?!
호갱구조대,20220810,pOpYOLcOQxs,님들이 뭔데요....?,왜 남양주 업적에 이재명 이름을 덮어씌워요?
호갱구조대,20220810,pOpYOLcOQxs,님들이 뭔데요....?,"리재명 혐오자지만, 저건 ㅈㄴ잘한거라고 유일하게 칭찬한다. 아 덕분에 분당 자택가격도 대떡상함 ㅆㅅㅌㅊ. 덕분에 분당구민이 서울 중급지랑 맞다이칠수있게되어 감사하므니다."
호갱구조대,20220810,pOpYOLcOQxs,님들이 뭔데요....?,이런 영상 공익광고로 매년 여름에 틀어주면 안될려나
호갱구조대,20220810,pOpYOLcOQxs,님들이 뭔데요....?,찢재명은 사랑입니다
호갱구조대,20220810,pOpYOLcOQxs,님들이 뭔데요....?,이건 솔직히 신고해도 아무도 안올것같다 그걸노린것 같음
호갱구조대,20220810,pOpYOLcOQxs,님들이 뭔데요....?,뭐하러 공무원 추가채용 합니까! 지금 공무원 놈들도 일 안하는데
호갱구조대,20220810,pOpYOLcOQxs,님들이 뭔데요....?,아니 이재명이 대화한답시고 저 사람들이랑 얘기했을때 얼마나 속이 터졌을까?
호갱구조대,20220810,pOpYOLcOQxs,님들이 뭔데요....?,강패도 어처구니 없었을 정도면 도대체 얼마나 노답들이였던거야?
호갱구조대,20220810,pOpYOLcOQxs,님들이 뭔데요....?,현실은 다시 한다고 합니다. 한달 일하고 1억 벌수 있는게 많지 않죠
호갱구조대,20220810,pOpYOLcOQxs,님들이 뭔데요....?,"한국이 갈길이 아직도 멀었삼. 켈리포니아  1/3 크기 나라에 이런거 하나못하는 이유가 후진국법문화이기 때문임. 근데 노력도 않함. OECD 자동차사고가 1위 ~2위 하는거보면,.... 분명히 방법이 있을텐데 그노력을 않하는게 문제임"
호갱구조대,20220810,pOpYOLcOQxs,님들이 뭔데요....?,아직은 필요악인건가
호갱구조대,20220810,pOpYOLcOQxs,님들이 뭔데요....?,"결국 돈많이 내고 불편하게 있다가 가냐..
돈 안내고 차박하며 개 더럽게 놀다가냐네..
뭐하러 저런데 가냐? 성격차이인거같은데..
이해하지 못한곳중 하나다"
호갱구조대,20220810,pOpYOLcOQxs,님들이 뭔데요....?,음주 운전하면 안 되는거 몰라서 음주운전 하나요? 산에서 불 사용 금지 몰라서 안 지키나요 담배꽁초 버리면 안 되는거 몰라서 안 버리나요?  대한민국 국민성이 전반적으로 이렇게 남 신경 안쓰고 나만 아니면 상관없는 이기주의인데 시민의식 교육이요? 그러면 안됩니다~ 하면 지키나요?
호갱구조대,20220810,pOpYOLcOQxs,님들이 뭔데요....?,찢재명의 몇안되는 업적
호갱구조대,20220810,pOpYOLcOQxs,님들이 뭔데요....?,세계 속의 작은 중국 헬조선
호갱구조대,20220810,pOpYOLcOQxs,님들이 뭔데요....?,법이 뭐같으면 불법은 판을치지
호갱구조대,20220810,pOpYOLcOQxs,님들이 뭔데요....?,"하아... 정상적으로 노동하는 사람들 바보만드는 범죄자들. 그냥 감옥가고 그동안 번 돈 다 추적해서 추징해야한다. 물론 매출원가 무시하고 매출기준으로. 권리금 받은것도 다 족치고.
이재명씨가 누군진 잘 몰라도 잘했네"
호갱구조대,20220810,pOpYOLcOQxs,님들이 뭔데요....?,"항상 목소리 큰놈들, 그냥 나라망한거 마냥 소리지르던 상인들이 이겨와서 남았던건데 저번엔 이재명 목소리가 더 컸음 ㅋㅋㅋ"
호갱구조대,20220810,pOpYOLcOQxs,님들이 뭔데요....?,불법인거 알면서도 하는 꼬라지 역겹다..
호갱구조대,20220810,pOpYOLcOQxs,님들이 뭔데요....?,정말 맞는말만!!좋아요
호갱구조대,20220810,pOpYOLcOQxs,님들이 뭔데요....?,이재명 별로 지지하진 않지만 이건 진짜 잘했다고 본다
호갱구조대,20220810,pOpYOLcOQxs,님들이 뭔데요....?,저 시켜주시면 가서 다뿌셔드림
호갱구조대,20220810,pOpYOLcOQxs,님들이 뭔데요....?,현대판 봉이 김선달 쓰레기들
호갱구조대,20220810,pOpYOLcOQxs,님들이 뭔데요....?,"방관한게 맞는 말임 언제나 철만되면 나오는 말인데
우물쭈물 거리는게 참.."
호갱구조대,20220810,pOpYOLcOQxs,님들이 뭔데요....?,민주당 지지안하긴 하는데 이재명이 계곡 싹 밀어버린거 ㅈㄴ 시원하긴했지
호갱구조대,20220810,pOpYOLcOQxs,님들이 뭔데요....?,재명이형 한번 더 때려부수자
호갱구조대,20220810,pOpYOLcOQxs,님들이 뭔데요....?,"그렇다고 이재명이 옳은건 아니지
이재명이 한 업무중에 잘한거 한가지일뿐"
호갱구조대,20220810,pOpYOLcOQxs,님들이 뭔데요....?,세상엔 남 등쳐먹으려는 나쁜놈들이 너무많아
호갱구조대,20220810,pOpYOLcOQxs,님들이 뭔데요....?,알 사람들은 다 알지만 지역 공무원들 다 저런 불법 영업장에서 뒷돈 받아서 절대 잡을 생각 안함.
호갱구조대,20220810,pOpYOLcOQxs,님들이 뭔데요....?,어이없는게 정부법이 얼마나 만만하면 벌금내고 장사하고있다고 합법이래  진짜 역겨움
호갱구조대,20220810,pOpYOLcOQxs,님들이 뭔데요....?,이런 거 보면 다 조져버려야함
호갱구조대,20220810,pOpYOLcOQxs,님들이 뭔데요....?,호갱구조대 다시활발하게 시작해서 좋아요 진짜 얻고싶은정보와 궁금했던정보를 넘 세세하게 알려주시네
호갱구조대,20220810,pOpYOLcOQxs,님들이 뭔데요....?,"본인 경기 사람인데 
이재명 경기 도지사 일때 
계곡 불법점유 업자 싹다 밀어버린다 할때 실제로 속 시원하게 
포크레인으로 부시고 철거하고 
벌금 물리고 바퀴벌레들 90% 사라졌는데 
지금 다시 하나둘 기어나오드라 
하지만 한다면 하는사람이라 뿌리뽑을거라고 해서 그런지 
경기도 민생특별사법경찰단 에서 
다시 벌레들 박멸중임 
경기도 내 불법 점유 싹다 벌레들 
자살시키고 죽여야 계곡도 깨끗해지고 
백숙 가격도 공평하게 된다 
다 죽여라 다시 단속하니까 
이번에 벌레마냥 했다안했다 몰래 
하다 3번이나 걸린 벌레새끼 있던데 
단속 신고 쫙 사진찍어 뿌렸으니 
다 걸려서 벌금처맞고 먹고살길 없으니 
처 자살하길"
호갱구조대,20220810,pOpYOLcOQxs,님들이 뭔데요....?,근데 이걸 이용해주는것도 문제다...
호갱구조대,20220810,pOpYOLcOQxs,님들이 뭔데요....?,"""당했다"""
호갱구조대,20220810,pOpYOLcOQxs,님들이 뭔데요....?,"그동안 방관한게 아니라
우리가 그것을 할 인물을 뽑지 못한 것이다
서로 싸우지 말고 일할사람한테
투표해라"
호갱구조대,20220810,pOpYOLcOQxs,님들이 뭔데요....?,조선의 유구한 전통
호갱구조대,20220810,pOpYOLcOQxs,님들이 뭔데요....?,오랫동안 블법장사를 해먹은 걸 그냥 내버려둔 국민들도 책임이 있음. 왜 그냥 물러서나. 우리 모두의 것인데.
호갱구조대,20220810,pOpYOLcOQxs,님들이 뭔데요....?,굳!!!!!!!!!!!!!!!!!!!!!!!!!!!!!!!!!!!!!!!!!!!!!!!!!!!!!!!!!!!!
호갱구조대,20220810,pOpYOLcOQxs,님들이 뭔데요....?,ㅎㅎ 우리 와이프가 열받아서 민원넣었지ㅋㅋㅋ 오기만을 기다리니 진짜와서 겁나뭐라하는데 너무 기분좋았다ㅋ
호갱구조대,20220810,pOpYOLcOQxs,님들이 뭔데요....?,"1:38 눈갱;; 바퀴벌레가 더 잘생겻다 ㄹㅇ 
칼빵놓으면 동물학대로 처벌받을 와꾸인듯"
호갱구조대,20220810,pOpYOLcOQxs,님들이 뭔데요....?,"이재명이 유능한 사람이었지
유일하게 더 나은 사람은 홍준표 였는데
....어쩌다 이렇게 되었을꼬"
호갱구조대,20220810,pOpYOLcOQxs,님들이 뭔데요....?,무슨 이재명? 남양주시장이 한건데
호갱구조대,20220810,pOpYOLcOQxs,님들이 뭔데요....?,"이거 원래 남양주 시장이 스타트 끊고 시작한건데
쥐도새도 모르게 사업계획 뺏은다음에 남양주 시청에 감사(징계)보내고 지자체에서 커피쿠폰 준거를 어거지로 징계때린 그..
메스컴에서 이걸로 주목받은 누구 시장 올려주니까 정신 나갈꺼같네요."
호갱구조대,20220810,pOpYOLcOQxs,님들이 뭔데요....?,이재명이 계곡 불법 식당 쓸어버리기 이거 잘했음.
호갱구조대,20220810,pOpYOLcOQxs,님들이 뭔데요....?,갓재명
호갱구조대,20220810,pOpYOLcOQxs,님들이 뭔데요....?,진짜 우리나라는 공뭔이 일 안할때가 많은 듯 근데 저걸 해결하고 보니 시민의식이 문제라니 끔찍하구만...
호갱구조대,20220810,pOpYOLcOQxs,님들이 뭔데요....?,유일하게 찢이 잘한 업적이군
호갱구조대,20220810,pOpYOLcOQxs,님들이 뭔데요....?,ㅋㅋㅋㅋㅋㅋㅋㅋㅋㅋㅋㅋㅋㅋㅋㅋ 진짜 못배워 처먹어서 저렇게 일하지 논리 이성은 개나주고 답답하다 ㅋㅋㅋㅋ
호갱구조대,20220810,pOpYOLcOQxs,님들이 뭔데요....?,개인소유 산은 어떻게 되나요???
호갱구조대,20220810,pOpYOLcOQxs,님들이 뭔데요....?,이야 찢었노....
호갱구조대,20220810,pOpYOLcOQxs,님들이 뭔데요....?,딴건 몰라도 재매이햄이 이거 하난 직이게 막았는데
호갱구조대,20220810,pOpYOLcOQxs,님들이 뭔데요....?,없어지더만 다시 생기나보네
호갱구조대,20220810,pOpYOLcOQxs,님들이 뭔데요....?,"공무원 더 뽑는건 진짜 세금 갖다버리는거지
지금 노는 공무원이 얼마나 많을텐데"
호갱구조대,20220810,pOpYOLcOQxs,님들이 뭔데요....?,한철장사=한철벌고 쭉 놀겠다
호갱구조대,20220810,pOpYOLcOQxs,님들이 뭔데요....?,좀 싸면 몰라. 비싸긴 뒤지게 비싸요 ㅋㅋ
호갱구조대,20220810,pOpYOLcOQxs,님들이 뭔데요....?,혹시 법을 공부하시는 분인가요? 일반인이라면 잘 모르는 사실들을 알려주시니 감사할 따름 이네요
호갱구조대,20220810,pOpYOLcOQxs,님들이 뭔데요....?,이재명 계곡 불법장사들 찢어버린건 너무 잘한거같음ㅇㅇ
호갱구조대,20220810,pOpYOLcOQxs,님들이 뭔데요....?,"왤까요? 표 무서워하는 쓰레기 정치인들과 표로 협박하는 쓰레기 인간들 때문이죠.
하지만 지금은 어떤게 옳았고, 그래서 누가 옳았는지 알 수 있죠.
누군가가 대통령이 됐다면 경기도가 아닌 전국에서 이런 불법영업 뿌리 뽑히지 않았을까요?"
호갱구조대,20220810,pOpYOLcOQxs,님들이 뭔데요....?,진짜 계곡들어갈려는데 길막으면 화염병으로 식당 불질러두 합법이야 머가리깨죽일넘들
호갱구조대,20220810,pOpYOLcOQxs,님들이 뭔데요....?,계곡사기꾼들 이은해한테 가스라이팅당해라
호갱구조대,20220810,pOpYOLcOQxs,님들이 뭔데요....?,권리금은 누가 받나요?
호갱구조대,20220810,pOpYOLcOQxs,님들이 뭔데요....?,이새끼들 다조져야지ㅋㅋ
호갱구조대,20220810,pOpYOLcOQxs,님들이 뭔데요....?,맞아요 이들은 개념부터 없네요 강제집행해야함
호갱구조대,20220810,pOpYOLcOQxs,님들이 뭔데요....?,"저런거 무시하고 놀면 안 돼요?
다투는거 피곤해서 그냥 돈 주는건가"
호갱구조대,20220810,pOpYOLcOQxs,님들이 뭔데요....?,어렸을때 매년 가던 계곡이 있었습니다 너x바우 라고 근데 이 가게도 철거를 당했는데 일장일단이 있습니다 일단 장점은 도로가 붐비지 않아 깨끗해졌다는것이고 단점은 놀만한 장소가 사라졌다는거죠 불법장사라곤 하지만 평상에서 소지품을 놓을 장소가 있으며 배고프면 비싸지만 음식이라도 시킬수 있었지만 그 자체가 이제는 불가능하니까요. 솔직히 말하면 어릴때 그 분위기가 그립긴 합니다
호갱구조대,20220810,pOpYOLcOQxs,님들이 뭔데요....?,"저건  법과제도는 만들고  그동안 관리를안했네요
즉  시스템이 제대로작동이안된거같은데
제대로작동하게끔 이재명지사가 해준거네요

불법으로 돈을 못벌게 해야 합니다
결국은 돌아돌아  모든시민이 피해봅니다"
호갱구조대,20220810,pOpYOLcOQxs,님들이 뭔데요....?,이죄명이나 불법장사꾼들이나 죄의식1도없네ㅋㅋ 도찐개찐
호갱구조대,20220810,pOpYOLcOQxs,님들이 뭔데요....?,이재명이 잘한것 저런것들 싹다 밀어버린거
호갱구조대,20220810,pOpYOLcOQxs,님들이 뭔데요....?,"저번에 무시하고 친구들이랑 가서
물놀이 하는데 주인이 물 바로 앞 까지 와서
나오라고 나오라고 소리를 지르더라 ㅋㅋ"
호갱구조대,20220810,pOpYOLcOQxs,님들이 뭔데요....?,국회의원좀 앖애고 공무원 더 늘리는게 좋을텐데
호갱구조대,20220810,pOpYOLcOQxs,님들이 뭔데요....?,"호갱....시원하네요...(^0^)乃
근데....당분간은...해결되기 힘들것 같네요...
ㅎㅎㅎ 😭 😢 😥 😭"
호갱구조대,20220810,pOpYOLcOQxs,님들이 뭔데요....?,저는 말하고 싶습니다 공무원은 관행이란 명목으로 뒷돈받고 허가 해주고 단속 소식 미리 통보해주고 벌금 회수하면 공무원들 승급점수 올라가고 저건 공무원 하고 짝고치지 않으면 저렇게 될수가 없는거다 3박자 이거 공무원이 썩어서 만들어진말임
호갱구조대,20220810,pOpYOLcOQxs,님들이 뭔데요....?,관할공무원들 절대 단속 안합니다~ 자기들이 피곤해지는것 1도 안하려하기때문
호갱구조대,20220810,pOpYOLcOQxs,님들이 뭔데요....?,이런거 보면 중국 딱히 욕할 필요가 없네. ㅎㅎㅎ 대한민국의 땅덩어리가 커지면 그게 곧 중국이라고 하던데 딱히 반박할 수가 없다.
호갱구조대,20220810,pOpYOLcOQxs,님들이 뭔데요....?,결론은 사회문제는 정부가 본격적으로 나서야지 해결되기 시작한다는 거죠
호갱구조대,20220810,pOpYOLcOQxs,님들이 뭔데요....?,솔직히 불법이긴 해도 사업하려고 확실히 평상이니 뭐니 잘해놔서 이용하긴 좋긴한데 문제는 적당히 해쳐먹었어야지 그럼 사람들도 그냥 눈감고 이해했을지도 모를텐데 백숙하나에 8만원씩 받아먹고 전 하나에 3만원씩 받으니까 신고하고 밀어버리는거에 동의하는거지
호갱구조대,20220810,pOpYOLcOQxs,님들이 뭔데요....?,이래서 배워야 하는건가..
호갱구조대,20220810,pOpYOLcOQxs,님들이 뭔데요....?,"저는 보수지지자입니다만,
이재명 전 지사가 이 점은 분명히 잘했다고 봅니다."
호갱구조대,20220810,pOpYOLcOQxs,님들이 뭔데요....?,"방관이라기 보다는 일선 지자체공무원들이 힘이 없기 때문입니다. 저 불법영업하는 사람도 민주주의에서 한 표를 갖고있는데 어떤 정치인(구청장, 군수 등)이 나서서 강력하게 단속하겠습니까? 이걸 표 의식하지 않고 밀어붙였던게 대단해서 이재명이 떳던겁니다."
호갱구조대,20220810,pOpYOLcOQxs,님들이 뭔데요....?,"엄연히 불법인데, 그들은 거기서 알박은 놈들 우린 시간내서 실갱이 하는것도 시간아까운 것들"
호갱구조대,20220810,pOpYOLcOQxs,님들이 뭔데요....?,애초에 지방쪽 공무원과 쟤네들은 한 몸임. 부산에서 그렇게 불법파라솔로 난리쳐도 근절이 안되는것처럼 공무원입장에서는 외부 관광객한테 잘보이고자 뒷돈까지 낭낭하게 상납하는 지역주민을 조질 이유가 없음.
호갱구조대,20220810,pOpYOLcOQxs,님들이 뭔데요....?,이재명전지사가 저것들 다 뿌셨을 때 사람들 반응은 엄청난 호응과 긍정이였음. 뿌셨을 때 진짜 속 시원했는데 제발 법 좀 제대로 만들자
호갱구조대,20220810,pOpYOLcOQxs,님들이 뭔데요....?,아이18 저런데 안가먄 돼지.ㅂㅅ들 보기도 싫다
호갱구조대,20220810,pOpYOLcOQxs,님들이 뭔데요....?,"2-3개월 투자금 회수했다 하는거면
양심상 깎아쳐서 오픈한거아님?
대체 얼마를 번거야ㅋㅋㅋㅋㅋㅋㅋㅋ"
호갱구조대,20220810,pOpYOLcOQxs,님들이 뭔데요....?,님들이 뭔데요가 늬들이 뭔데요~?로 읽히는건 나뿐이냥?ㅋㅋ
호갱구조대,20220810,pOpYOLcOQxs,님들이 뭔데요....?,어매디졌네ㅋㅋㅋㅋㅋㅋㅋㅋㅋㅋㅋㅋㅋㅋㅋㅋㅋㅋㅋㅋㅋㅋㅋㅋ
호갱구조대,20220810,pOpYOLcOQxs,님들이 뭔데요....?,역시 구조대
호갱구조대,20220810,pOpYOLcOQxs,님들이 뭔데요....?,와 이 형.. 간단 명료하게 딱딱 설명 잘해주니까 귀에 쏙쏙 박히네 언제 이렇게 떡상했지… 10만 때 그냥 그런가 보다하고 좋은 유튜버네 하고 지나갔는데 와… 역시 좋은 일하면 따라오는 구나
호갱구조대,20220810,pOpYOLcOQxs,님들이 뭔데요....?,찢재명이 하기전에 다른분이 먼저 한거아닌가?ㅋ 찢지지지인가?ㅋ
호갱구조대,20220810,pOpYOLcOQxs,님들이 뭔데요....?,"계곡가면 영상의 법 나오는부분
보여드리면서 ㅈ같은 소리 못 하도록
입틀막 해드려야겠네요ㅎㅎ

그래도 강요하면 경찰 부르던가, 너는 짖어라 나는 들어갈련다 시전 하시면 됩니다.
+ 쓰레기는 잘 챙겨옵시다!!"
호갱구조대,20220810,pOpYOLcOQxs,님들이 뭔데요....?,전에 간 곳이 불법이였누
호갱구조대,20220810,pOpYOLcOQxs,님들이 뭔데요....?,2찍남이고 이재명 싫어하는데 깔껀 까지만 칭찬할 건 칭찬한다. 저새끼들 참교육한 거 이재명이 잘한 거다. 이국종 도운 것도 잘한 거고.
호갱구조대,20220810,pOpYOLcOQxs,님들이 뭔데요....?,속이뻥
호갱구조대,20220810,pOpYOLcOQxs,님들이 뭔데요....?,"저런 날강도들 개무시하고 계곡에서 물놀이만 하고 
음식은 예약한 숙박시설에서 드시던가 해서 저 쌍놈들이 
돈을 못챙겨가야 합니다."
호갱구조대,20220810,pOpYOLcOQxs,님들이 뭔데요....?,밳슉먹자했자나!
호갱구조대,20220810,pOpYOLcOQxs,님들이 뭔데요....?,벌금을 50만원에서 올려서 50억 때립시다. 국세청에서 특별세무조사팀 꾸려서 탈탈 털어가고요.
호갱구조대,20220810,pOpYOLcOQxs,님들이 뭔데요....?,그니깐 밤치하는 시장들 공무원들 쟤들한테 뭐 안받는지 조사해봐야되
호갱구조대,20220810,pOpYOLcOQxs,님들이 뭔데요....?,원래 조폭이 권력을 잡으면 추진력 하나는 좋습니다. 추진력을 원하신다면 조폭에게 투표하십시다.
호갱구조대,20220810,pOpYOLcOQxs,님들이 뭔데요....?,"진짜 뻔뻔하다,, 불법인주제에 양아치들  응원합니다 호갱구조대!!"
호갱구조대,20220810,pOpYOLcOQxs,님들이 뭔데요....?,좀더 생각해보니 저기 무지성으로 드가서 평상을 써도 될거 같은데? 어차피 불법 영업이니 내가 사용햇다고 해서 쟤들이 손해본것도 아니고 그래서 물어낼것도 없자나 ㅋㅋㅋㅋㅋ 평상도 공짜로 쓰고 완전 개꿀멍꿀이네
호갱구조대,20220810,pOpYOLcOQxs,님들이 뭔데요....?,"계곡은 
자유민주주의 우파동맹국 
( Republic of Korea ) 한국 시민이라면! 

그 어떤 견찰, 용역깡패 , 불법 점거 백숙집이 깝쳐도
법적으로 이기는데요??? 계속에서 걍 배째고 수영해도 됩니다.

우리나라 땅에있는 접근가능 지역 계곡에   
왜 내가  나랑똑같은 고작 시민따리한테  돈을 줌? 호구임?"
호갱구조대,20220810,pOpYOLcOQxs,님들이 뭔데요....?,없앴다더니...
호갱구조대,20220810,pOpYOLcOQxs,님들이 뭔데요....?,하이 시브레  조낸 날카로워 급소를 정확히 찌르네
호갱구조대,20220810,pOpYOLcOQxs,님들이 뭔데요....?,형 그러면 걍 무시하고 들어가면되는거야?
호갱구조대,20220810,pOpYOLcOQxs,님들이 뭔데요....?,돈 좀 쓰더라도 수영장 잘되어있는 리조트 가는게 마음 편하네요.  계곡안간지 수년은 됐습니다.
호갱구조대,20220810,pOpYOLcOQxs,님들이 뭔데요....?,"결국 일한거는 이재명밖에 없다는거
충북도 좀 일좀 해라!!! 다 돈내고 들어가야된대 쓰바"
호갱구조대,20220810,pOpYOLcOQxs,님들이 뭔데요....?,싹다 철거하지않음?
호갱구조대,20220810,pOpYOLcOQxs,님들이 뭔데요....?,이재명  경기도 지사일때 다 철거했는데 지금 또 생기고 있다고함
호갱구조대,20220810,pOpYOLcOQxs,님들이 뭔데요....?,역시 이재명
호갱구조대,20220810,pOpYOLcOQxs,님들이 뭔데요....?,BBQ는 3만원만 받는다하니 혜자구나!
호갱구조대,20220810,pOpYOLcOQxs,님들이 뭔데요....?,진짜 거를 타선이 없넼ㅋㅋㅋ
호갱구조대,20220810,pOpYOLcOQxs,님들이 뭔데요....?,백슉먹자 켓자나~
호갱구조대,20220810,pOpYOLcOQxs,님들이 뭔데요....?,-던지가 아니고 -든지가 맞는 표현입니다.
호갱구조대,20220810,pOpYOLcOQxs,님들이 뭔데요....?,이걸 보고 사람들 갈때마다 신고1회씩 하면 50씩 계속 나갈려나ㅋㅋㅋ
호갱구조대,20220810,pOpYOLcOQxs,님들이 뭔데요....?,"남양주에서 먼저 한 거 따라한 거긴 하지만 어쨌든 하긴 한 거니까. 그나마 이재명이 성남시장, 경기도지사 거치면서 내세울만한 유일한 업적이긴 하지. 전에는 대장동도 업적이라더니만 언젠가부턴 말이 바뀌었더라고. ㅋ"
호갱구조대,20220810,pOpYOLcOQxs,님들이 뭔데요....?,이재명 오빠 최고~👍
호갱구조대,20220810,pOpYOLcOQxs,님들이 뭔데요....?,갓재명 그립다
호갱구조대,20220810,pOpYOLcOQxs,님들이 뭔데요....?,그냥 버러지만도 못한 색히들이죠. 죄다 깜빵보내야됨
호갱구조대,20220810,pOpYOLcOQxs,님들이 뭔데요....?,평상에서 돈받는게 불법이긴 하지만 평상영업주가 피서객이 놀다간 쓰레기 다 깨끗이 치우는걸 보면 관리 측면에서는 효율적이라는 생각은 들었습니다. 주인없는 계곡들 놀다간 흔적 보면 쓰레기 그대로 두고가고 난장판인데 이런면에서는 필요하다는 생각이 들기도 합니다.
호갱구조대,20220810,pOpYOLcOQxs,님들이 뭔데요....?,해결 방법 사형 과 포상금
호갱구조대,20220810,pOpYOLcOQxs,님들이 뭔데요....?,이쯤되면 이재명이 정말 대단하다고 볼수밖에 없다....
호갱구조대,20220810,pOpYOLcOQxs,님들이 뭔데요....?,"흥해라~ 호갱구조대!!
언제나 바른소리!!!"
호갱구조대,20220810,pOpYOLcOQxs,님들이 뭔데요....?,"바이든이 우영우 팽나무 보러 방한했다는 주장을 하는 신박한 유튜버 좀 취재해주세요..ㅎㅎ
https://youtu.be/O24oi0DisA8"
호갱구조대,20220810,pOpYOLcOQxs,님들이 뭔데요....?,저새끼들 싹다아아아아 범죄자새끼들임 아주 ㅈ같은 새끼들 싹다 깜방에 쳐넣어야함
호갱구조대,20220810,pOpYOLcOQxs,님들이 뭔데요....?,권리금? 사유지가 아닌 국토에?
호갱구조대,20220810,pOpYOLcOQxs,님들이 뭔데요....?,쇠파이프들고 저 평상들 다 깨부셔도 상관없죠??
호갱구조대,20220810,pOpYOLcOQxs,님들이 뭔데요....?,이재명이 대통령이 되었어야 하는데. 아쉽.
호갱구조대,20220810,pOpYOLcOQxs,님들이 뭔데요....?,"더 쉬운 방법있음 걍 신고하셈
나도 어릴때 몰랐는데 차타고 계곡 갔다가 1시간동안 싸우고 걍 신고했음"
호갱구조대,20220810,pOpYOLcOQxs,님들이 뭔데요....?,부모잃은 애들이 사업장 이용하는 거라 신경 안써도됨
호갱구조대,20220810,pOpYOLcOQxs,님들이 뭔데요....?,진짜 국가는 뭐하냐 일 ㅈㄴ안해
